audio,sentence
/scratch/skscla001/experiments/datasets/swagen/audio/common_voice_sw_30025434.wav,ndio wafanye maamuzi utanashati na usafi ni sifa nyingine muhimu kwa kabila hili 
/scratch/skscla001/experiments/datasets/swagen/audio/common_voice_sw_30054973.wav,budya ni kisiwa kinachopatikana tanzania katika bahari ya hindi 
/scratch/skscla001/experiments/datasets/swagen/audio/common_voice_sw_36390421.wav,dhambi zangu zote wala si nusu 
/scratch/skscla001/experiments/datasets/swagen/audio/common_voice_sw_34597390.wav,watu wana uhakika kuhusu sauti zinazorekodiwa 
/scratch/skscla001/experiments/datasets/swagen/audio/common_voice_sw_28994731.wav,ngano ambayo ni mazao makuu asia ya kusini ndiyo inayotumiwa 
/scratch/skscla001/experiments/datasets/swagen/audio/common_voice_sw_30671871.wav,kwenye nafasi mojawapo za nyuma na kumuweka kama mshambuliaji 
/scratch/skscla001/experiments/datasets/swagen/audio/common_voice_sw_28714506.wav,shirika la ndege la uingereza linatokana na shirika hili 
/scratch/skscla001/experiments/datasets/swagen/audio/common_voice_sw_30198414.wav,alipokufa milki ilichukuliwa na dada yake mwene ngalu ambaye ndiye mwanzilishi wa sumbawanga 
/scratch/skscla001/experiments/datasets/swagen/audio/common_voice_sw_30574135.wav,alikuwa na nia ya kujenga muungano wa afrika ili iwe kitu kimoja 
/scratch/skscla001/experiments/datasets/swagen/audio/common_voice_sw_28811327.wav,serikali za china na wakati wa vita pia japan walifanya mipango ya ujenzi 
/scratch/skscla001/experiments/datasets/swagen/audio/common_voice_sw_29793226.wav,jitihada hizo zilishindikana kufuatia hali ya nkrumah kuwa mbaya 
/scratch/skscla001/experiments/datasets/swagen/audio/common_voice_sw_30635647.wav,party walipewa nafasi serikalini kufikia machi okello 
/scratch/skscla001/experiments/datasets/swagen/audio/common_voice_sw_34746354.wav,sehemu kubwa zaidi ya afrika ya mashariki inapeleka maji kwenda mabeseni ya rufiji 
/scratch/skscla001/experiments/datasets/swagen/audio/common_voice_sw_30038227.wav,jumla ya mapato na kiwango cha bei ya kawaida 
/scratch/skscla001/experiments/datasets/swagen/audio/common_voice_sw_29996312.wav,tuhangaikie malazi mavazi na chakula 
/scratch/skscla001/experiments/datasets/swagen/audio/common_voice_sw_35279637.wav,ni watu wangapi watu gani unawatakia kuwatakia idd 
/scratch/skscla001/experiments/datasets/swagen/audio/common_voice_sw_30116004.wav,biashara ya watumwa ilianza kuonekana kama biashara ovu ambayo ilisababisha vifo 
/scratch/skscla001/experiments/datasets/swagen/audio/common_voice_sw_37331886.wav,takribani watu thamanini na saba wameuawa na mamia kujeruhiwa 
/scratch/skscla001/experiments/datasets/swagen/audio/common_voice_sw_36252472.wav,na na na namna hiyo unatamani watu wapone magonjwa yao 
/scratch/skscla001/experiments/datasets/swagen/audio/common_voice_sw_30243488.wav,mkoa unapakana na nchi ya kenya na uganda kwa upande wa kaskazini 
/scratch/skscla001/experiments/datasets/swagen/audio/common_voice_sw_35182024.wav,vigumu kwenda haja ndogo na hii pia umeleta utata thelathini na tisa ukeketaji ni 
/scratch/skscla001/experiments/datasets/swagen/audio/common_voice_sw_30566574.wav,ikifikia upeo katika sherehe ya eunoto yaani ujio wa umri 
/scratch/skscla001/experiments/datasets/swagen/audio/common_voice_sw_29898595.wav,vijana wa kiume ni walilishwa kwa kupigwa mijeledi wakiwa uchi 
/scratch/skscla001/experiments/datasets/swagen/audio/common_voice_sw_29907118.wav,ambayo ni msimu wa vuli unaoanzia mwezi oktoba desemba 
/scratch/skscla001/experiments/datasets/swagen/audio/common_voice_sw_34823908.wav,kusababisha madhara makubwa ya kiafya lakini kivyovyote vile ni upungufu mkubwa 
/scratch/skscla001/experiments/datasets/swagen/audio/common_voice_sw_30007107.wav,miezi kadhaa inayofuata tohara hata hivyo nyekundu ni rangi iliyopendelewa 
/scratch/skscla001/experiments/datasets/swagen/audio/common_voice_sw_30057773.wav,raul gonzalez mfumania nyavu wa hispania alicheza madrid 
/scratch/skscla001/experiments/datasets/swagen/audio/common_voice_sw_29323788.wav,ni maarufu kwa ngano zake 
/scratch/skscla001/experiments/datasets/swagen/audio/common_voice_sw_30021461.wav,mbali na filamu hiyo kuna filamu takribani kumi na moja 
/scratch/skscla001/experiments/datasets/swagen/audio/common_voice_sw_36375244.wav,sheria hiyo haihusiani tu na utegemeaji wa dawa 
/scratch/skscla001/experiments/datasets/swagen/audio/common_voice_sw_35989418.wav,nyinyi ni watoto wa maria 
/scratch/skscla001/experiments/datasets/swagen/audio/common_voice_sw_28817377.wav,lugha muziki michezo au sanaa 
/scratch/skscla001/experiments/datasets/swagen/audio/common_voice_sw_29799220.wav,akizungumza katika ofisi za mwananchi jana zuhura anasema ndoto ya udaktari ilikufa 
/scratch/skscla001/experiments/datasets/swagen/audio/common_voice_sw_29796948.wav,na hawakuambiwa kuwa wanakwenda kulima mkonge walikubali na hatimaye hawakukuta hata kimoja 
/scratch/skscla001/experiments/datasets/swagen/audio/common_voice_sw_34906962.wav,ndio maana wanawake wameanza kutafuta namna nyingine 
/scratch/skscla001/experiments/datasets/swagen/audio/common_voice_sw_36382383.wav,inaathiri takribani asilimia sitini ya wananchi 
/scratch/skscla001/experiments/datasets/swagen/audio/common_voice_sw_28662831.wav,mara nyingi hali hiyo husababishwa na ajali au kuzaliwa hivyo hivyo 
/scratch/skscla001/experiments/datasets/swagen/audio/common_voice_sw_37093117.wav,tulivyo katika ligi ya hapa uganda 
/scratch/skscla001/experiments/datasets/swagen/audio/common_voice_sw_28950448.wav,katika kuleta amani ana kipaji cha pekee 
/scratch/skscla001/experiments/datasets/swagen/audio/common_voice_sw_34947086.wav,kifo cha seyyid barghash kilimleta kwenye kiti cha usultan seyyid khalifa 
/scratch/skscla001/experiments/datasets/swagen/audio/common_voice_sw_28583654.wav,eneo la ziwa ni kavu sana na maji yake ni ya magadi 
/scratch/skscla001/experiments/datasets/swagen/audio/common_voice_sw_29789083.wav,waliombukizwa virusi vya homa ya ini wakiwa watoto 
/scratch/skscla001/experiments/datasets/swagen/audio/common_voice_sw_30629509.wav,uliofuata ni mkataba wa sant germain na austria uliosainiwa tarehe kumi 
/scratch/skscla001/experiments/datasets/swagen/audio/common_voice_sw_30674889.wav,vile watoto wadogo wa shule waliokuwa watukutu kwa 
/scratch/skscla001/experiments/datasets/swagen/audio/common_voice_sw_30338761.wav,mitihani yao ya kumaliza kidato cha sita na 
/scratch/skscla001/experiments/datasets/swagen/audio/common_voice_sw_34834642.wav,madai hayo hayakuwa na athari kubwa kisiasa 
/scratch/skscla001/experiments/datasets/swagen/audio/common_voice_sw_36105817.wav,sawa na asilimia ishirini na saba 
/scratch/skscla001/experiments/datasets/swagen/audio/common_voice_sw_30221370.wav,chato ni mojawapo ya wilaya tano za mkoa mpya wa geita uliopo kaskazini magharibi 
/scratch/skscla001/experiments/datasets/swagen/audio/common_voice_sw_28661946.wav,kwenye maeneo jirani na syria wako pia waarabu 
/scratch/skscla001/experiments/datasets/swagen/audio/common_voice_sw_30073514.wav,nigeria ilishinda ubingwa kwa kuifunga zambia 
/scratch/skscla001/experiments/datasets/swagen/audio/common_voice_sw_30376731.wav,mwaka elfu moja mia tisa tisini na nne 
/scratch/skscla001/experiments/datasets/swagen/audio/common_voice_sw_37099057.wav,uwezo wa kukusanyika ripoti juu ya watu milioni ishirini na tano wa marekani bila 
/scratch/skscla001/experiments/datasets/swagen/audio/common_voice_sw_30074831.wav,haya yote ndio yatakayokamilisha safari ya matembezi hifadhini 
/scratch/skscla001/experiments/datasets/swagen/audio/common_voice_sw_31262001.wav,ukijisahau kusema maneno ya kumsifia mwenyekiti wa chama watu watakushangaa 
/scratch/skscla001/experiments/datasets/swagen/audio/common_voice_sw_35105016.wav,mwanamke ni pambo la nyumba ndani 
/scratch/skscla001/experiments/datasets/swagen/audio/common_voice_sw_29924574.wav,utafiti huu unafanywa na kikundi cha wanasayansi wa kimataifa kutoka vyuo vikuu mbalimbali duniani 
/scratch/skscla001/experiments/datasets/swagen/audio/common_voice_sw_29793050.wav,mkutano mkuu ulipiga kura na kumchagua magufuli kuwa mgombea urais wa chama cha mapinduzi 
/scratch/skscla001/experiments/datasets/swagen/audio/common_voice_sw_36331449.wav,watu wanarudia matokeo ya vipimo kila maada ya miezi mitatu 
/scratch/skscla001/experiments/datasets/swagen/audio/common_voice_sw_36617546.wav,yeye ni mshambuliaji wa juu kabisa ureno wakati wote 
/scratch/skscla001/experiments/datasets/swagen/audio/common_voice_sw_29822462.wav,tozo hizi zimeondolewa ili kuwawezesha wafanyabiashara kufanya biashara zao hapa nchini 
/scratch/skscla001/experiments/datasets/swagen/audio/common_voice_sw_29677966.wav,wanafunzi wa kwanza walianza kozi zao januari ya mwaka ya mwaka huo 
/scratch/skscla001/experiments/datasets/swagen/audio/common_voice_sw_29949521.wav,miongoni mwa filamu ambazo amewahi kuigiza ni rangi ya zambarau 
/scratch/skscla001/experiments/datasets/swagen/audio/common_voice_sw_28804143.wav,kwa hiyo lugha imetoweka kabisa kwa sasa 
/scratch/skscla001/experiments/datasets/swagen/audio/common_voice_sw_36331632.wav,ameachiliwa baada ya chama tawala nchini humo 
/scratch/skscla001/experiments/datasets/swagen/audio/common_voice_sw_35105174.wav,hii inafanya waturuki wahisi kuwajibika zaidi lakini 
/scratch/skscla001/experiments/datasets/swagen/audio/common_voice_sw_30443876.wav,babdari nyingine iliyotumiwa kukusanya mizigo kwa ajili ya kusafirishwa kwenda ulaya 
/scratch/skscla001/experiments/datasets/swagen/audio/common_voice_sw_37226242.wav,walanguzi kuhatarisha maisha ya watoto walemavu 
/scratch/skscla001/experiments/datasets/swagen/audio/common_voice_sw_34958484.wav,wakimaliza mafunzo yao ya maisha kama watu binafsi huendeleza umoja wao 
/scratch/skscla001/experiments/datasets/swagen/audio/common_voice_sw_36040423.wav,hapo ndio ilibidi nichukue hatua ya kutoroka nyumbani 
/scratch/skscla001/experiments/datasets/swagen/audio/common_voice_sw_29960695.wav,mashamba hayo hayawezi kudumisha idadi kubwa ya wanyama 
/scratch/skscla001/experiments/datasets/swagen/audio/common_voice_sw_37229709.wav,picha hiyo ilipigwa aprili mwaka elfu moja mia tisa tisini 
/scratch/skscla001/experiments/datasets/swagen/audio/common_voice_sw_29925229.wav,mke wake aliitwa mwene wakulosi ambaye walijaliwa kupata watoto watatu 
/scratch/skscla001/experiments/datasets/swagen/audio/common_voice_sw_30173188.wav,maonyesho katika ngazi ya kitaifa yataadhimishwa uwanja wa nyakabindi 
/scratch/skscla001/experiments/datasets/swagen/audio/common_voice_sw_30099281.wav,messi analipwa bilioni tatu za kitanzania kwa wiki 
/scratch/skscla001/experiments/datasets/swagen/audio/common_voice_sw_35183952.wav,baada ya kumaliza kinywaji jacob alisimama na kuangalia picha za ofisini kwa bi anita 
/scratch/skscla001/experiments/datasets/swagen/audio/common_voice_sw_29389832.wav,viongozi wengi hasa mawaziri wa serikali ya umoja wa kitaifa walishindwa kushika viti bungeni 
/scratch/skscla001/experiments/datasets/swagen/audio/common_voice_sw_28695291.wav,afya ya meno ni sehemu muhimu ya afya ya mwili kwa jumla 
/scratch/skscla001/experiments/datasets/swagen/audio/common_voice_sw_35181604.wav,twendeni kwetu ama kwao 
/scratch/skscla001/experiments/datasets/swagen/audio/common_voice_sw_36746492.wav,kiswahili si dhaifu wa nadharia hii ni kwamba 
/scratch/skscla001/experiments/datasets/swagen/audio/common_voice_sw_36387318.wav,abiria wa titanic walisimulia hadithi za kweli 
/scratch/skscla001/experiments/datasets/swagen/audio/common_voice_sw_30653650.wav,asilimia ishirini na mbili pekee za mto nile ndizo zinahusishwa na misri 
/scratch/skscla001/experiments/datasets/swagen/audio/common_voice_sw_29922493.wav,hifadhi hii ipo ndani ya bonde la ufa 
/scratch/skscla001/experiments/datasets/swagen/audio/common_voice_sw_28583544.wav,kanisa hilo lina pia jimbo la mt 
/scratch/skscla001/experiments/datasets/swagen/audio/common_voice_sw_37089548.wav,hasa mtu kama waziri mkuu nadhani 
/scratch/skscla001/experiments/datasets/swagen/audio/common_voice_sw_29936928.wav,wasichana husimama mbele ya wanaume na kusokota miili huku wakiimba 
/scratch/skscla001/experiments/datasets/swagen/audio/common_voice_sw_31306591.wav,iliwafanya wakoloni kumlazimisha nyerere kuchagua kati ya siasa na kazi ya ualimu 
/scratch/skscla001/experiments/datasets/swagen/audio/common_voice_sw_30561937.wav,mei kumi elfu moja mia tisa themanini na nane maalim self alikamatwa na polisi 
/scratch/skscla001/experiments/datasets/swagen/audio/common_voice_sw_37096435.wav,katika maeneo ya mpwapwa na dodoma mwaka 
/scratch/skscla001/experiments/datasets/swagen/audio/common_voice_sw_30378326.wav,kuliongeza umuhimu wa mwambao wa mlima karibu na unguja 
/scratch/skscla001/experiments/datasets/swagen/audio/common_voice_sw_37094149.wav,ni mmoja wa wazee niliofanya nao mazungumzo anasema kuwa shujaa huyo alizaliwa hapa 
/scratch/skscla001/experiments/datasets/swagen/audio/common_voice_sw_30105025.wav,ushindi wetu ni uthibitisho kuwa mikakati ya lengo letu imeanza vizuri 
/scratch/skscla001/experiments/datasets/swagen/audio/common_voice_sw_34745897.wav,kama alivyojiwa hapo na mwenzangu victor macsedek 
/scratch/skscla001/experiments/datasets/swagen/audio/common_voice_sw_29898191.wav,kutokana na wakati baadhi ya vitu kwenye magofu hayo vinaibwa vinaharibiwa 
/scratch/skscla001/experiments/datasets/swagen/audio/common_voice_sw_30005181.wav,walihamia huko wakushi kutoka kaskazini nao wakameza kwa kiasi kikubwa wakazi asili 
/scratch/skscla001/experiments/datasets/swagen/audio/common_voice_sw_36386141.wav,uturuki na ugiriki mnamo mwaka wa elfumoja miatisa hamsini na mbili 
/scratch/skscla001/experiments/datasets/swagen/audio/common_voice_sw_36384314.wav,kipindi cha kutazamana risasi yalifyatuliwa wanamgambo nane 
/scratch/skscla001/experiments/datasets/swagen/audio/common_voice_sw_30180377.wav,manyatta hizo hazina ua za kulinda boma ili kusisitiza jukumu lao la kulinda jamii 
/scratch/skscla001/experiments/datasets/swagen/audio/common_voice_sw_29457597.wav,mji mkuu wa tanzania ni jiji la dodoma 
/scratch/skscla001/experiments/datasets/swagen/audio/common_voice_sw_29897546.wav,bagamoyo imehifadhi siri nyingi za mali kale ambazo watanzania wengi hawazijui 
/scratch/skscla001/experiments/datasets/swagen/audio/common_voice_sw_30522730.wav,uzalishaji unaohusisha nguo vinywaji na vyakula 
/scratch/skscla001/experiments/datasets/swagen/audio/common_voice_sw_28582893.wav,milo iliyotengenezwa nje ya australia hutengenezwa tofauti ili kutumika kwa urahisi 
/scratch/skscla001/experiments/datasets/swagen/audio/common_voice_sw_29749154.wav,unaishia kwenye bahari ya atlantiki 
/scratch/skscla001/experiments/datasets/swagen/audio/common_voice_sw_31996485.wav,wakati ni kama upanga 
/scratch/skscla001/experiments/datasets/swagen/audio/common_voice_sw_28681404.wav,hapa alishiriki katika jitihada za kubuni mavazi ya kitaifa ya tanganyika 
/scratch/skscla001/experiments/datasets/swagen/audio/common_voice_sw_30305638.wav,waliokataa kuwapa ardhi wazungu ili wafanye kazi zao 
/scratch/skscla001/experiments/datasets/swagen/audio/common_voice_sw_32210622.wav,nchu akitaka kuanda kunena kwanda huangalia lake 
/scratch/skscla001/experiments/datasets/swagen/audio/common_voice_sw_36251180.wav,wangekuwa wanaweza kuwa na uwezo wa kuwa na fedha wangekuwa 
/scratch/skscla001/experiments/datasets/swagen/audio/common_voice_sw_30378274.wav,tofauti na hali ya zamani iliyokuwa ikitoa nafasi ya kutumika kwa vitu asilia 
/scratch/skscla001/experiments/datasets/swagen/audio/common_voice_sw_28689058.wav,katika imani yao kuna miungu mingi kwenye ngazi mbalimbali ya enzi 
/scratch/skscla001/experiments/datasets/swagen/audio/common_voice_sw_29792077.wav,tausi ni ndege mwenye rangi ya bluu na kijani 
/scratch/skscla001/experiments/datasets/swagen/audio/common_voice_sw_30630996.wav,wasifu wa magufuli unaonyesha kwamba alipata cheti cha stashahada ya ualimu 
/scratch/skscla001/experiments/datasets/swagen/audio/common_voice_sw_28660748.wav,unaweza kufanywa naye au na watu wengine kwa kibali chake au bila ya hicho 
/scratch/skscla001/experiments/datasets/swagen/audio/common_voice_sw_31996650.wav,wanasiasa wako wanacheka kwa pamoja 
/scratch/skscla001/experiments/datasets/swagen/audio/common_voice_sw_30148066.wav,lakini kwa upande wa pili kuna ufafanuzi wa kisayansi kuhusu jambo hili 
/scratch/skscla001/experiments/datasets/swagen/audio/common_voice_sw_30182723.wav,kwa ujumla hivyo jamii ndiyo nguvu kazi katika nchi hasa nchini tanzania 
/scratch/skscla001/experiments/datasets/swagen/audio/common_voice_sw_31284654.wav,kijana huyo alipokua kwa vile chifu mwamududa hakuwa na mtoto wa kiume 
/scratch/skscla001/experiments/datasets/swagen/audio/common_voice_sw_34756682.wav,maji taka yalielekezwa chini ya mitaro iliyofunikwa kando ya barabara kuu 
/scratch/skscla001/experiments/datasets/swagen/audio/common_voice_sw_37089091.wav,kupitia kaskazini na kumwaga majiyake katika ziwa victoria 
/scratch/skscla001/experiments/datasets/swagen/audio/common_voice_sw_30574535.wav,huku kundi lingine likiendelea kuelekea mashariki kupitia mlima sekenke hadi kisiriri 
/scratch/skscla001/experiments/datasets/swagen/audio/common_voice_sw_36389899.wav,china ina eneo la kilomita za mraba 
/scratch/skscla001/experiments/datasets/swagen/audio/common_voice_sw_34823691.wav,kilimalizika kufuatia kifo cha ghafla cha dikteta wa zamani sani 
/scratch/skscla001/experiments/datasets/swagen/audio/common_voice_sw_28670603.wav,kwa matumizi kwenye ndege kuna vipimo sanifu vidogo zaidi 
/scratch/skscla001/experiments/datasets/swagen/audio/common_voice_sw_34597699.wav,mkewe ni mwenye bidii sana 
/scratch/skscla001/experiments/datasets/swagen/audio/common_voice_sw_31304319.wav,kijadi wamasai hula nyama na maziwa pia damu ya ngombe 
/scratch/skscla001/experiments/datasets/swagen/audio/common_voice_sw_29792394.wav,vilevile joketi ni miongoni mwa vijana maarufu sana nchini humo 
/scratch/skscla001/experiments/datasets/swagen/audio/common_voice_sw_34597853.wav,ni madhara na maovu yake yote 
/scratch/skscla001/experiments/datasets/swagen/audio/common_voice_sw_30020746.wav,ila aliwahi kuwa kocha mkuu wa geita gold lipuli na polisi tanzania 
/scratch/skscla001/experiments/datasets/swagen/audio/common_voice_sw_31304305.wav,nyumbu huzaliana sana na kufikia nyumbu laki tano wanaozaliwa kwa mwaka 
/scratch/skscla001/experiments/datasets/swagen/audio/common_voice_sw_34762883.wav,kisha huzaa mtoto mmoja tu twiga ni baadhi ya wanyama wachache wanao zaa wakiwa 
/scratch/skscla001/experiments/datasets/swagen/audio/common_voice_sw_30075144.wav,forojo ganze aliyezaliwa mwaka elfu moja mia tisa na mbili 
/scratch/skscla001/experiments/datasets/swagen/audio/common_voice_sw_36253358.wav,alikuwa amepoteza masaa meengi alipokuwa amepoteza fahamu 
/scratch/skscla001/experiments/datasets/swagen/audio/common_voice_sw_37223857.wav,imani hiyo hadi urusi mtemi wa kiev vladimir mkuu alipokea 
/scratch/skscla001/experiments/datasets/swagen/audio/common_voice_sw_29702320.wav,imani inaweza kukua kwa upana na kwa dhati au nguvu 
/scratch/skscla001/experiments/datasets/swagen/audio/common_voice_sw_30574445.wav,ipo pia halmashauri ya wilaya ya kaliua na halmashauri ya wilaya ya igunga 
/scratch/skscla001/experiments/datasets/swagen/audio/common_voice_sw_29924751.wav,ingawa hakuna idadi kamili ya watu waliouliwa wakati wa utawala wa idi amin 
/scratch/skscla001/experiments/datasets/swagen/audio/common_voice_sw_37090203.wav,ambazo zingine na zile sifurahie akaruhusu ziendelee katika 
/scratch/skscla001/experiments/datasets/swagen/audio/common_voice_sw_32243357.wav,maji ya kupwa maji yamejaa maji yavuta 
/scratch/skscla001/experiments/datasets/swagen/audio/common_voice_sw_28584420.wav,katika kiingereza cha uingereza inaendelea kushikilia maana hii 
/scratch/skscla001/experiments/datasets/swagen/audio/common_voice_sw_30579043.wav,kiwi anatoka familia moja na mbuni 
/scratch/skscla001/experiments/datasets/swagen/audio/common_voice_sw_30323506.wav,jiji linamkakati wa kuhakikisha linatoa elimu ya kilimo 
/scratch/skscla001/experiments/datasets/swagen/audio/common_voice_sw_37096132.wav,wapenzi wa jinsia moja wapigwa picha nchini kenya 
/scratch/skscla001/experiments/datasets/swagen/audio/common_voice_sw_30577567.wav,haki ya mageuzi haina misingi ya kisheria ya kubadili tabia ama mawazo 
/scratch/skscla001/experiments/datasets/swagen/audio/common_voice_sw_29791457.wav,asili yake ni ni kutoka wanawake wa zanzibar 
/scratch/skscla001/experiments/datasets/swagen/audio/common_voice_sw_30631353.wav,mwombaji akiamua mwizi auawe basi kwa vile anaonekana kwenye matambiko 
/scratch/skscla001/experiments/datasets/swagen/audio/common_voice_sw_32091669.wav,nneno ambalo latumika 
/scratch/skscla001/experiments/datasets/swagen/audio/common_voice_sw_31271403.wav,kipindi ambacho wageni kutoka mashariki ya mbali wanafika maeneo ya pwani 
/scratch/skscla001/experiments/datasets/swagen/audio/common_voice_sw_28666462.wav,ikiwa na mipango ya kuongeza nchi kama angola south sudan and uganda 
/scratch/skscla001/experiments/datasets/swagen/audio/common_voice_sw_29791176.wav,mkapa aliendelea kuwa mshauri wa serikali hadi umauti ulipompata 
/scratch/skscla001/experiments/datasets/swagen/audio/common_voice_sw_28836347.wav,ni kati ya maajabu makubwa ya dunia hii 
/scratch/skscla001/experiments/datasets/swagen/audio/common_voice_sw_28581560.wav,hewa yenyewe ni gimba la gesi 
/scratch/skscla001/experiments/datasets/swagen/audio/common_voice_sw_37090922.wav,ya kwanza ya wakristo chini ya serikali petro ni mfano mzuri wa 
/scratch/skscla001/experiments/datasets/swagen/audio/common_voice_sw_36067098.wav,mwaka wa elfu moja mia tisa arobaini na tisa 
/scratch/skscla001/experiments/datasets/swagen/audio/common_voice_sw_30495093.wav,ni kitoweo kitamu sana kwa mujibu wa wenyeji na watalii pia 
/scratch/skscla001/experiments/datasets/swagen/audio/common_voice_sw_31808946.wav,shoka zilizotumika kwa kazi ya kuvunja mifupa nyembe na visu 
/scratch/skscla001/experiments/datasets/swagen/audio/common_voice_sw_37088806.wav,kihistoria hazijakuwa na mafanikio kama ule wa tiba mbadala 
/scratch/skscla001/experiments/datasets/swagen/audio/common_voice_sw_30436690.wav,simba huwindwa wanapowaua mifugo yao hwauwa pia 
/scratch/skscla001/experiments/datasets/swagen/audio/common_voice_sw_29897878.wav,matukio ya kwanza yalikuwa katika kikundi kidogo cha waraibu wa dawa za kulevya 
/scratch/skscla001/experiments/datasets/swagen/audio/common_voice_sw_29884798.wav,pep guardiola alivyoenda ujerumani alianza kubadili mfumo 
/scratch/skscla001/experiments/datasets/swagen/audio/common_voice_sw_30090642.wav,yohane paulo wa pili alitoa mafundisho mengi kuhusu jamii 
/scratch/skscla001/experiments/datasets/swagen/audio/common_voice_sw_29793689.wav,kila kinachowapendeza ndani ya macho yao ndicho wanachofanya 
/scratch/skscla001/experiments/datasets/swagen/audio/common_voice_sw_32101561.wav,daktari menena mame afungwe mai tupa mbili 
/scratch/skscla001/experiments/datasets/swagen/audio/common_voice_sw_36616509.wav,ni muhimu katika kusimamia utoaji haki nchini 
/scratch/skscla001/experiments/datasets/swagen/audio/common_voice_sw_30209681.wav,je mtapiga kambi na katika kupiga kambi ni lazima mbebe mahema yenu 
/scratch/skscla001/experiments/datasets/swagen/audio/common_voice_sw_30020917.wav,sheria hizi zilithibitishwa na baraza la mapinduzi zanzibar 
/scratch/skscla001/experiments/datasets/swagen/audio/common_voice_sw_30363041.wav,waziri mkuu majaliwa tarehe kumi na tisa novemba elfu mbili na kumi na tano 
/scratch/skscla001/experiments/datasets/swagen/audio/common_voice_sw_28830745.wav,ilikuwa shule ya kwanza ya biashara ya kijani nchini afrika 
/scratch/skscla001/experiments/datasets/swagen/audio/common_voice_sw_30227390.wav,ripoti za mashirika makubwa zinapotolewa 
/scratch/skscla001/experiments/datasets/swagen/audio/common_voice_sw_30624139.wav,tdege waliyobaki kwenye hifadhi wanapatikana kwenye misitu 
/scratch/skscla001/experiments/datasets/swagen/audio/common_voice_sw_35104576.wav,yesu aliwaambia hivi msidhani ya kuwa nalikuja kuitangua torati au manabii sikuja kutangua bali 
/scratch/skscla001/experiments/datasets/swagen/audio/common_voice_sw_35132512.wav,ngoma hizo huchezwa watu wakiwa wamevaa nguo za asili 
/scratch/skscla001/experiments/datasets/swagen/audio/common_voice_sw_29620744.wav,kuna aina mbalimbali 
/scratch/skscla001/experiments/datasets/swagen/audio/common_voice_sw_28660718.wav,wimbo ulitolewa kunako tarehe moja mwezi wa pili 
/scratch/skscla001/experiments/datasets/swagen/audio/common_voice_sw_28814453.wav,wadudu barafu wanatokea amerika ya kaskazini na asia ya mashariki juu ya milima 
/scratch/skscla001/experiments/datasets/swagen/audio/common_voice_sw_35582730.wav,moja aliiga mfumo wa kijeshi wa wasangu waliowahi kuwa kabila lenye nguvu kwa kujifunza 
/scratch/skscla001/experiments/datasets/swagen/audio/common_voice_sw_28672764.wav,nyimbo hizo zote zinapatikana katika albamu ya ndani ya bongo ya sugu 
/scratch/skscla001/experiments/datasets/swagen/audio/common_voice_sw_30115959.wav,baadhi ya mikoa inalima mazao kama ndizi na muhogo 
/scratch/skscla001/experiments/datasets/swagen/audio/common_voice_sw_30026345.wav,watalii wanapenda kununua vitu ambavyo nchini kwao havipo 
/scratch/skscla001/experiments/datasets/swagen/audio/common_voice_sw_30200638.wav,messi alifanya kila mbinu kuinusulu timu 
/scratch/skscla001/experiments/datasets/swagen/audio/common_voice_sw_36384115.wav,raia wa uingerza wanataka aendelee kutawala 
/scratch/skscla001/experiments/datasets/swagen/audio/common_voice_sw_30522533.wav,kwa sasa uwapo katika eneo hili la makumbusho ya handebevyo utagundua kasoro nyingi 
/scratch/skscla001/experiments/datasets/swagen/audio/common_voice_sw_35155545.wav,jacob matata alichungulia nje 
/scratch/skscla001/experiments/datasets/swagen/audio/common_voice_sw_37097771.wav,sisi tuko hapa mpaka saa nane 
