audio,sentence
/scratch/skscla001/experiments/datasets/swagen/audio/common_voice_sw_29948454.wav,blia kusahau halmashauri ya wilaya ya chato na halmasahauri ya mji wa geita 
/scratch/skscla001/experiments/datasets/swagen/audio/common_voice_sw_34946674.wav,ramadhan machaku wa ubalozini camp area six morogoro tanzania 
/scratch/skscla001/experiments/datasets/swagen/audio/common_voice_sw_35146264.wav,naye sekretari wa rais yoweri museveni tamale mirundi alielezea rekodi ya idi amin ya 
/scratch/skscla001/experiments/datasets/swagen/audio/common_voice_sw_37086779.wav,ni kielelezo cha ineffiency tu yaani kwamba ile 
/scratch/skscla001/experiments/datasets/swagen/audio/common_voice_sw_35107621.wav,aliwakilisha jimbo la morogoro kuanzia mwaka elfu moja mia tisa sitini 
/scratch/skscla001/experiments/datasets/swagen/audio/common_voice_sw_29790348.wav,maalim seif alipata asilimia arobaini na tisa nukta saba sita 
/scratch/skscla001/experiments/datasets/swagen/audio/common_voice_sw_34942763.wav,kijamii ya kiutu uzima kwa wakati unaotazamiwa 
/scratch/skscla001/experiments/datasets/swagen/audio/common_voice_sw_37332145.wav,kutokana na kuiuzia kenya bidhaa zake katika mwezi huo 
/scratch/skscla001/experiments/datasets/swagen/audio/common_voice_sw_36375123.wav,hati inaweza kuwahusisha watazamaji na hadhira 
/scratch/skscla001/experiments/datasets/swagen/audio/common_voice_sw_28662043.wav,dalili zinaweza kujumuisha maumivu na ugumu wa kula chakula 
/scratch/skscla001/experiments/datasets/swagen/audio/common_voice_sw_29993831.wav,au juu ya kile kilichomuliwa na mkutano huo wa berlini 
/scratch/skscla001/experiments/datasets/swagen/audio/common_voice_sw_34598100.wav,mapumziko wa bath huchukuliwa kuwa mojawapo ya miji 
/scratch/skscla001/experiments/datasets/swagen/audio/common_voice_sw_36331661.wav,na kwamba wako pale kwa maslahi yao binafsi 
/scratch/skscla001/experiments/datasets/swagen/audio/common_voice_sw_30337044.wav,pia wananchi wa maeneo hayo hasa wafanya biashara 
/scratch/skscla001/experiments/datasets/swagen/audio/common_voice_sw_35160859.wav,siku mbili kabla ya wavulana kutahiriwa vichwa vyao hunyolewa themanini na moja kisha vijana 
/scratch/skscla001/experiments/datasets/swagen/audio/common_voice_sw_29356397.wav,hali hiyo inaweza kutokea kiasili katika mazingira maalumu au kwa kutumia mbinu fulani 
/scratch/skscla001/experiments/datasets/swagen/audio/common_voice_sw_29943400.wav,maharage ni mazuri kwasababu yana faida nyingi mwilini ikiwemo kushusha shinikizo la damu 
/scratch/skscla001/experiments/datasets/swagen/audio/common_voice_sw_35526214.wav,huku wakipigwa butwaa wasijue la kufanya wakazi hao 
/scratch/skscla001/experiments/datasets/swagen/audio/common_voice_sw_36381643.wav,sisi ni watoto wa baba noah 
/scratch/skscla001/experiments/datasets/swagen/audio/common_voice_sw_30107678.wav,wanacheza kwa siku nne siku mbili zikijulikana kama siku nyeupe 
/scratch/skscla001/experiments/datasets/swagen/audio/common_voice_sw_30025305.wav,karume alitoa mchango mkubwa sana katika serikali ya mapinduzi ya zanzibar 
/scratch/skscla001/experiments/datasets/swagen/audio/common_voice_sw_28666649.wav,hizi ni pamoja na 
/scratch/skscla001/experiments/datasets/swagen/audio/common_voice_sw_30220174.wav,pep hakutwaa kombe lolote la ligi ya uingereza 
/scratch/skscla001/experiments/datasets/swagen/audio/common_voice_sw_29713637.wav,husaidia kutofautisha utambuzi kati ya utegemezi pombe na matumizi sugu ya pombe 
/scratch/skscla001/experiments/datasets/swagen/audio/common_voice_sw_35123718.wav,jamhuri ya kiarabu waingereza waliacha nchi mikononi mwa mfalme 
/scratch/skscla001/experiments/datasets/swagen/audio/common_voice_sw_36383742.wav,hupewa maelekezo na ushauri unaohusiana na majukumu yao mapya 
/scratch/skscla001/experiments/datasets/swagen/audio/common_voice_sw_30242126.wav,timu ya taifa ya uganda ilicheza fainali dhidi ya ghana 
/scratch/skscla001/experiments/datasets/swagen/audio/common_voice_sw_36318657.wav,mipango kuwahimiza wamasai kuachana na jadi ya uhamaji ili kuishi maisha ya kisasa bado 
/scratch/skscla001/experiments/datasets/swagen/audio/common_voice_sw_36389498.wav,wakati ambao kuna maumivu makali kwenda haja ndogo 
/scratch/skscla001/experiments/datasets/swagen/audio/common_voice_sw_29618169.wav,pia ni wimbo pekee kutoka katika albamu kuwa na muziki wa video 
/scratch/skscla001/experiments/datasets/swagen/audio/common_voice_sw_29943822.wav,aligawa maduka na biashara yao kwa ndugu au wafuasi wa rais 
/scratch/skscla001/experiments/datasets/swagen/audio/common_voice_sw_30148699.wav,iliyojulikana kwa jina la boshazi maana yake bondei zigua sambaa 
/scratch/skscla001/experiments/datasets/swagen/audio/common_voice_sw_30382277.wav,rais wa tano john pombe magufuli chama cha mapinduzi 
/scratch/skscla001/experiments/datasets/swagen/audio/common_voice_sw_28696377.wav,pia alikuwa mkuu wa utawala wa kikoloni wa eneo hilo 
/scratch/skscla001/experiments/datasets/swagen/audio/common_voice_sw_36252906.wav,ini haikuwa bahati yake kama unavyofahamu kifo 
/scratch/skscla001/experiments/datasets/swagen/audio/common_voice_sw_35442443.wav,watatu waliomkaribia aliagiza kuwaua bila kuongea nao kumbe walikuwa mabalozi wa mkwawa aliyetaka kujadiliana 
/scratch/skscla001/experiments/datasets/swagen/audio/common_voice_sw_35409396.wav,ule umoja wa vyama vya wafanyikazi uliokuwepo ukiwakutanisha vyama vinane 
/scratch/skscla001/experiments/datasets/swagen/audio/common_voice_sw_30365311.wav,baadhi ya wadau hao ni kilimo cha biashara karagwe 
/scratch/skscla001/experiments/datasets/swagen/audio/common_voice_sw_34906981.wav,tungepiga mbizi ndani ya bahari 
/scratch/skscla001/experiments/datasets/swagen/audio/common_voice_sw_32244971.wav,anaimba nyimbo za kanisani 
/scratch/skscla001/experiments/datasets/swagen/audio/common_voice_sw_36318599.wav,na kwa sasa wanashikilia nyadhifa kuu sana 
/scratch/skscla001/experiments/datasets/swagen/audio/common_voice_sw_35132750.wav,emmanuel ni mrefu 
/scratch/skscla001/experiments/datasets/swagen/audio/common_voice_sw_29938497.wav,zinazotiririsha maji kuelekea bondeni kwenye makazi ya watu 
/scratch/skscla001/experiments/datasets/swagen/audio/common_voice_sw_31812394.wav,milima ya katete na milima ya katutu 
/scratch/skscla001/experiments/datasets/swagen/audio/common_voice_sw_37094907.wav,watano walioshtakiwa kwa kosa la mauwaji ya biko 
/scratch/skscla001/experiments/datasets/swagen/audio/common_voice_sw_30436263.wav,wahehe waliahidi kukabidhi bunduki zote za gobori 
/scratch/skscla001/experiments/datasets/swagen/audio/common_voice_sw_36318757.wav,anahakikisha mafanikio katika vita au mvua za kutosha 
/scratch/skscla001/experiments/datasets/swagen/audio/common_voice_sw_28704537.wav,mmojawapo maji yanafikia ziwa tanganyika 
/scratch/skscla001/experiments/datasets/swagen/audio/common_voice_sw_29805801.wav,wanasheria waliruhusiwa kufanya kazi zanzibar watu hawakugongewa tena milango usiku 
/scratch/skscla001/experiments/datasets/swagen/audio/common_voice_sw_30105457.wav,wakati sultani sayyid said alipoamua kuhamisha makao yake makuu 
/scratch/skscla001/experiments/datasets/swagen/audio/common_voice_sw_35180778.wav,mtoto wake ameng ara sana 
/scratch/skscla001/experiments/datasets/swagen/audio/common_voice_sw_30351433.wav,nchi ya tanzania ilizisaidia nchi nyingi sana duniani 
/scratch/skscla001/experiments/datasets/swagen/audio/common_voice_sw_29942721.wav,kwenye miaka ya elfu moja mia saba hamsini 
/scratch/skscla001/experiments/datasets/swagen/audio/common_voice_sw_29986407.wav,mnyama huyo licha ya sifa hiyo anasifa nyingi nyingi katika maisha yake 
/scratch/skscla001/experiments/datasets/swagen/audio/common_voice_sw_36038675.wav,na waturuki na hata zaidi kuwaonyesha hasira yako 
/scratch/skscla001/experiments/datasets/swagen/audio/common_voice_sw_35284665.wav,mji mkongwe wenye historia kubwa una majengo mengi ya kihistoria 
/scratch/skscla001/experiments/datasets/swagen/audio/common_voice_sw_35104628.wav,pengine kusiwe na kinyongo ame amenifurahisha sana profesa 
/scratch/skscla001/experiments/datasets/swagen/audio/common_voice_sw_30180459.wav,kati ya hao kuna wanaocheza timu za ligi kuu ulaya 
/scratch/skscla001/experiments/datasets/swagen/audio/common_voice_sw_30182996.wav,kwa hiyo ni sehemu au sekta inayotoa mchango mkubwa kwa jamii 
/scratch/skscla001/experiments/datasets/swagen/audio/common_voice_sw_35099624.wav,nikusaidieje tafadhali 
/scratch/skscla001/experiments/datasets/swagen/audio/common_voice_sw_29793886.wav,kumekuwa na upotovu wa mila na tamaduni za baadhi ya makabila 
/scratch/skscla001/experiments/datasets/swagen/audio/common_voice_sw_29976799.wav,milima ya nyabweshongoile na milima ya nyakagando 
/scratch/skscla001/experiments/datasets/swagen/audio/common_voice_sw_34755892.wav,hali ambayo inatajwa na mkurugenzi wa wizara ya afya 
/scratch/skscla001/experiments/datasets/swagen/audio/common_voice_sw_36389494.wav,milima inayopanda hadi ya kimo cha m elfu tatu mia sita kumi na moja 
/scratch/skscla001/experiments/datasets/swagen/audio/common_voice_sw_30180212.wav,jimbo ambalo linashiriki mpaka na uganda 
/scratch/skscla001/experiments/datasets/swagen/audio/common_voice_sw_29822903.wav,wengi wao hawajasoma kabisa lakini ni matajiri wakubwa 
/scratch/skscla001/experiments/datasets/swagen/audio/common_voice_sw_30080507.wav,mbuni anakimbia kuliko viumbe wote wenye miguu miwili 
/scratch/skscla001/experiments/datasets/swagen/audio/common_voice_sw_30343093.wav,elfu moja mia nane na nne aliimarisha utawala wa omani 
/scratch/skscla001/experiments/datasets/swagen/audio/common_voice_sw_34832281.wav,ni vizuri tukae vizuri na majirani zetu 
/scratch/skscla001/experiments/datasets/swagen/audio/common_voice_sw_28681259.wav,yapo magonjwa mengi ya ini 
/scratch/skscla001/experiments/datasets/swagen/audio/common_voice_sw_30201827.wav,kila ukoo ulikuwa na kitu walichokatazwa kula omuziro 
/scratch/skscla001/experiments/datasets/swagen/audio/common_voice_sw_30677299.wav,kufanya kuwa ajali mbaya zaidi ya meli kuliko zote 
/scratch/skscla001/experiments/datasets/swagen/audio/common_voice_sw_30326879.wav,eneo hili hutumiwa kama makazi ya watu sehemu za biashara 
/scratch/skscla001/experiments/datasets/swagen/audio/common_voice_sw_28735758.wav,mojawapo ni kukutana na watu wa kupendeza kwa wema wao 
/scratch/skscla001/experiments/datasets/swagen/audio/common_voice_sw_29885099.wav,nahisi hiyo salamu yako nayo nahisi ni chafu hivyo hivyo 
/scratch/skscla001/experiments/datasets/swagen/audio/common_voice_sw_30180841.wav,abedi ayew pele alikuwa mchezaji bora wa afrika 
/scratch/skscla001/experiments/datasets/swagen/audio/common_voice_sw_35181902.wav,sana kwa sababu kilimo chao ni cha mazao ya kudumu kama kahawa na ndizi 
/scratch/skscla001/experiments/datasets/swagen/audio/common_voice_sw_29988826.wav,alikiri kwenye kitabu chake hicho kuwa tukio hilo litaendelea kuwa doa jeusi 
/scratch/skscla001/experiments/datasets/swagen/audio/common_voice_sw_29796634.wav,hilo lilikuwa tangazo rasmi la vita 
/scratch/skscla001/experiments/datasets/swagen/audio/common_voice_sw_30342394.wav,mkataba wake utaanza mwaka elfu mbili na ishirini 
/scratch/skscla001/experiments/datasets/swagen/audio/common_voice_sw_29995742.wav,kulinda mifugo dhidi ya wanyama wakali kurudisha mifugo iliyoibiwa au kupotea 
/scratch/skscla001/experiments/datasets/swagen/audio/common_voice_sw_30539562.wav,hakuna timu bora kama barcelona ya miaka kumi iliyopita 
/scratch/skscla001/experiments/datasets/swagen/audio/common_voice_sw_35099500.wav,taasisi za kimataifa kufanya uchunguzi wa matokeo 
/scratch/skscla001/experiments/datasets/swagen/audio/common_voice_sw_34958793.wav,mizimu wakupa kweli wakueleze undani 
/scratch/skscla001/experiments/datasets/swagen/audio/common_voice_sw_29997547.wav,arsenal walilala kwa mabao mawili kwa moja dhidi ya vijana wa frank rijkard 
/scratch/skscla001/experiments/datasets/swagen/audio/common_voice_sw_36319765.wav,kuna siku saba kwa wiki 
/scratch/skscla001/experiments/datasets/swagen/audio/common_voice_sw_35442270.wav,matatizo makuu ya binadamu ingawa wachache tu wameweza 
/scratch/skscla001/experiments/datasets/swagen/audio/common_voice_sw_29795499.wav,afrika mashariki ilianzisha umoja wao chini ya nyerere 
/scratch/skscla001/experiments/datasets/swagen/audio/common_voice_sw_36386334.wav,bairu walikuwa na koo kama mia moja thelathini 
/scratch/skscla001/experiments/datasets/swagen/audio/common_voice_sw_30022226.wav,meno yake ya chini ya mbele hungolewa 
/scratch/skscla001/experiments/datasets/swagen/audio/common_voice_sw_29258950.wav,nchini tanzania afisa mtendaji wa kata huitwa katibu kata 
/scratch/skscla001/experiments/datasets/swagen/audio/common_voice_sw_29978475.wav,quran yatufahamisha kuwa ismail alikua mpole na mnyenyekevu kwa mola wake 
/scratch/skscla001/experiments/datasets/swagen/audio/common_voice_sw_30631065.wav,anasema zuhura ambaye ni mwanamke wa kwanza kutangaza kipindi cha televisheni 
/scratch/skscla001/experiments/datasets/swagen/audio/common_voice_sw_29787628.wav,yapo madai kuwa ilikuwa imebeba zaidi ya abiria elfu moja mia mbili 
/scratch/skscla001/experiments/datasets/swagen/audio/common_voice_sw_36390419.wav,hawai ni kwetu 
/scratch/skscla001/experiments/datasets/swagen/audio/common_voice_sw_29895541.wav,aliapishwa kama waziri mkuu wa kenya baada ya miaka zaidi ya arobaini ya kukoma 
/scratch/skscla001/experiments/datasets/swagen/audio/common_voice_sw_36387489.wav,muziki ambao vijana wengi ndio huvutiwa nao zaidi 
/scratch/skscla001/experiments/datasets/swagen/audio/common_voice_sw_29904775.wav,karibu na ziwa viktoria kuna tambarare yenye mafuriko yaliyotokana na matandiko ya ziwa 
/scratch/skscla001/experiments/datasets/swagen/audio/common_voice_sw_36389582.wav,lake la heshima likimaanisha kiongozi aliyetwaa nchi nyingimkwawa alizaliwa mnamo mwaka elfu moja 
/scratch/skscla001/experiments/datasets/swagen/audio/common_voice_sw_30079880.wav,akabadilisha upepo uliodumu kwa miaka kumi na nne 
/scratch/skscla001/experiments/datasets/swagen/audio/common_voice_sw_31284930.wav,watu walihofia kuwa volkano inaweza kulipuka 
/scratch/skscla001/experiments/datasets/swagen/audio/common_voice_sw_30582821.wav,hifadhi ya kilimanjaro hiyo inajumuisha mlima kilimanjaro 
/scratch/skscla001/experiments/datasets/swagen/audio/common_voice_sw_30395017.wav,nkrumah alitaka kurudi afrika baada ya vita ya pili ya dunia 
/scratch/skscla001/experiments/datasets/swagen/audio/common_voice_sw_30177396.wav,kitu cha msingi ni kuangalia na kuzifanyia kazi sifa unazozitaka kutoka kwa mpenzi wako 
/scratch/skscla001/experiments/datasets/swagen/audio/common_voice_sw_29922947.wav,hifadhi hii ina ukubwa wa kilomita za mraba mia saba hamsini na tano 
/scratch/skscla001/experiments/datasets/swagen/audio/common_voice_sw_29993436.wav,alisoma katika chuo kikuu cha dayatar nairobi kenya 
/scratch/skscla001/experiments/datasets/swagen/audio/common_voice_sw_30355412.wav,kutoka daressalaam mpaka kahama mkoani shinyanga 
/scratch/skscla001/experiments/datasets/swagen/audio/common_voice_sw_30034722.wav,alizikwa mahali pa kuzaliwa kwake kijiji cha butiama 
/scratch/skscla001/experiments/datasets/swagen/audio/common_voice_sw_37095311.wav,haruhusiwi kutumia vyakula vya mafuta ya wanyama 
/scratch/skscla001/experiments/datasets/swagen/audio/common_voice_sw_29896648.wav,alikuwa kiongozi ambaye hajali matatizo ya wengine 
/scratch/skscla001/experiments/datasets/swagen/audio/common_voice_sw_29792873.wav,alifanya ziara kwa ajili ya kufanya shughuli mbalimbali za kanisa 
/scratch/skscla001/experiments/datasets/swagen/audio/common_voice_sw_28695758.wav,hujenga tago lao juu ya mti msituni 
/scratch/skscla001/experiments/datasets/swagen/audio/common_voice_sw_30243287.wav,japo pia neno hili shahi linamaanisha kabila la wakurya 
/scratch/skscla001/experiments/datasets/swagen/audio/common_voice_sw_29789622.wav,mahali ambapo palijengwa kijiji kinachoitwa mvumi makulu 
/scratch/skscla001/experiments/datasets/swagen/audio/common_voice_sw_28995030.wav,ndio mwisho wa amerika kuelekea ncha ya kaskazini 
/scratch/skscla001/experiments/datasets/swagen/audio/common_voice_sw_28874561.wav,tangu kale anaheshimiwa na kanisa katoliki waorthodoksi na wengineo kama mtakatifu 
/scratch/skscla001/experiments/datasets/swagen/audio/common_voice_sw_31308918.wav,kisha yanakuacha utunze mahusiano yako kwa gharama zako 
/scratch/skscla001/experiments/datasets/swagen/audio/common_voice_sw_29970339.wav,tumia bidhaa za nywele zinaendana na nywele zako 
/scratch/skscla001/experiments/datasets/swagen/audio/common_voice_sw_31787809.wav,mwanasiasa tundu lissu anaijia siasa vyema 
/scratch/skscla001/experiments/datasets/swagen/audio/common_voice_sw_36732160.wav,kuvuka kwenda upande mwingine wa barabara kugonga kuni mara tatu 
/scratch/skscla001/experiments/datasets/swagen/audio/common_voice_sw_29994960.wav,moi alimpa uhuru kenyatta na fursa ya kugombea urais katika uchaguzi 
/scratch/skscla001/experiments/datasets/swagen/audio/common_voice_sw_30179631.wav,walisema hao walikuwa ni washauri wa kijeshi na si wapiganaji wa mstari wa mbele 
/scratch/skscla001/experiments/datasets/swagen/audio/common_voice_sw_30124432.wav,kama wazaramo na wakaguru pia wakutu na wakwere 
/scratch/skscla001/experiments/datasets/swagen/audio/common_voice_sw_34762875.wav,warieri wakine wasweta na waganjo wagire wakiseru wakamageta na waturi 
/scratch/skscla001/experiments/datasets/swagen/audio/common_voice_sw_30026208.wav,uro milioni mia moja thelathini 
/scratch/skscla001/experiments/datasets/swagen/audio/common_voice_sw_30568017.wav,mchezaji bora wa dunia mara tano cristiano ronaldo 
/scratch/skscla001/experiments/datasets/swagen/audio/common_voice_sw_30123144.wav,aina mbalimbali za nyoka nazo hupatikana ndani ya dar zoo 
/scratch/skscla001/experiments/datasets/swagen/audio/common_voice_sw_30574770.wav,pia utazidi kuonekana kuwa mrembo zaidi 
/scratch/skscla001/experiments/datasets/swagen/audio/common_voice_sw_37226165.wav,uchaguzi ulirudiwa tena mwaka elfu mbili na kumi na sita 
/scratch/skscla001/experiments/datasets/swagen/audio/common_voice_sw_36382109.wav,jopo la wataalamu linafanya majadiliano yaende vizuri sana 
/scratch/skscla001/experiments/datasets/swagen/audio/common_voice_sw_34390842.wav,kujiuzulu kutokana na chama hicho kutajwa kuhusika kwenye uchunguzi 
/scratch/skscla001/experiments/datasets/swagen/audio/common_voice_sw_28716342.wav,aina fulani za chati ni bora zaidi kwa kuwasilisha data kuliko nyingine 
/scratch/skscla001/experiments/datasets/swagen/audio/common_voice_sw_30002327.wav,waliishi pamoja na wanyama pori wengi huku wakikataa kula wanyama hao 
/scratch/skscla001/experiments/datasets/swagen/audio/common_voice_sw_35206727.wav,amir habib jamal aliongoza kuanzia tarehe ishirini na sita januari 
/scratch/skscla001/experiments/datasets/swagen/audio/common_voice_sw_37101434.wav,ya sokomoko la brexit wakati waingereza watakapoamka 
/scratch/skscla001/experiments/datasets/swagen/audio/common_voice_sw_29939018.wav,pia hifadhi hii inapitiwa na njia ya treni inayoelekea katika taifa jirani la zambia 
/scratch/skscla001/experiments/datasets/swagen/audio/common_voice_sw_29790076.wav,maziwa ya mtindi yana asidi za asili 
/scratch/skscla001/experiments/datasets/swagen/audio/common_voice_sw_30105912.wav,mheshimiwa daktari john joseph pombe magufuli alifanikiwa kuteuliwa kuipeperusha bendera ya chama 
/scratch/skscla001/experiments/datasets/swagen/audio/common_voice_sw_37088575.wav,maandishi ya lemkin yaliitwa utawala wa kiaksisi 
/scratch/skscla001/experiments/datasets/swagen/audio/common_voice_sw_30717705.wav,sir edward mutesa wa pili alikuwa rais wa taifa 
/scratch/skscla001/experiments/datasets/swagen/audio/common_voice_sw_29793885.wav,kila mtu aliamini pep atamaliza maisha yake ya soka 
/scratch/skscla001/experiments/datasets/swagen/audio/common_voice_sw_34597432.wav,silaha zote pamoja na ramia ndogo zilizotekwa zilipelekwa iringa kalenga na kuhifadhiwa ghalani 
/scratch/skscla001/experiments/datasets/swagen/audio/common_voice_sw_30327081.wav,uingereza mara nyingi wanakosa timu bora yenyewe uwezo wa kushindana na mataifa mengine 
/scratch/skscla001/experiments/datasets/swagen/audio/common_voice_sw_29981325.wav,simba kupanda miti siyo jambo la kawaida lakini manyara ni kama jadi 
/scratch/skscla001/experiments/datasets/swagen/audio/common_voice_sw_36013923.wav,hali ya kushuka kwa theluji bado imeendelea kutikisa nchi mbalimbali na wakati huu marekani 
/scratch/skscla001/experiments/datasets/swagen/audio/common_voice_sw_30052383.wav,hali hii ilisababisha kuongezeka kwa biashara ya watumwa hasa kutoka afrika 
/scratch/skscla001/experiments/datasets/swagen/audio/common_voice_sw_36319593.wav,david zacharia kafulila anakuwa mkuu mpya wa mkoa wa arusha 
/scratch/skscla001/experiments/datasets/swagen/audio/common_voice_sw_35146036.wav,ni victor abuso nakutakia jumapili njema na kama kawaida 
/scratch/skscla001/experiments/datasets/swagen/audio/common_voice_sw_37083272.wav,ika kampani zangu kutiliamukazo swala la kutilia amani na utulivu 
/scratch/skscla001/experiments/datasets/swagen/audio/common_voice_sw_30566941.wav,rose muhando alizawadiwa tuzo ya mtunzi mzuri wa nyimbo 
/scratch/skscla001/experiments/datasets/swagen/audio/common_voice_sw_35099289.wav,ghana na mmoja wa viongozi wenye nia ya kujenga muungano wa afrika tena mchochezi 
/scratch/skscla001/experiments/datasets/swagen/audio/common_voice_sw_29934950.wav,papa pote watalii wanapata nafasi ya kuogelea nao bila tatizo lolote 
/scratch/skscla001/experiments/datasets/swagen/audio/common_voice_sw_30574785.wav,ni ukweli wa mambo ya kwamba jamii ya kabila la maasai 
/scratch/skscla001/experiments/datasets/swagen/audio/common_voice_sw_31406048.wav,flaviana matata alijitahidi kutimiza ndoto zake 
/scratch/skscla001/experiments/datasets/swagen/audio/common_voice_sw_35132373.wav,hata ukipenda kweli huwezi jua sababu ni siri ya moyo wako 
/scratch/skscla001/experiments/datasets/swagen/audio/common_voice_sw_29798597.wav,osama alikua tajiri mkubwa saudi arabia alianza kusimamia 
/scratch/skscla001/experiments/datasets/swagen/audio/common_voice_sw_36642911.wav,alipanda mpakangazi ya kuwa afisa wa mipango serikalini 
/scratch/skscla001/experiments/datasets/swagen/audio/common_voice_sw_30579044.wav,hii ya mwisho inaweza ikahitaji mjadala kidogo 
/scratch/skscla001/experiments/datasets/swagen/audio/common_voice_sw_36311018.wav,wa kisiasa wa negus negesti mfalme wa ethiopia tangu mwaka 
/scratch/skscla001/experiments/datasets/swagen/audio/common_voice_sw_30320135.wav,magufuli alianza kuchapa kazi usiku na mchana 
/scratch/skscla001/experiments/datasets/swagen/audio/common_voice_sw_30116108.wav,washirazi walijigamba kwamba ndio walinunua eneo hilo kutokana na migogoro iliyokuwapo ushirazi 
/scratch/skscla001/experiments/datasets/swagen/audio/common_voice_sw_30005144.wav,wanyambo hupenda kula ndizi kama chakula chao 
/scratch/skscla001/experiments/datasets/swagen/audio/common_voice_sw_31812061.wav,mji wa bagamoyo unaotafsiri kuhusu dini ya kiislamu na utamaduni wake 
/scratch/skscla001/experiments/datasets/swagen/audio/common_voice_sw_37088987.wav,abrahamu kama kielelezo cha imani na rafiki wa mungu 
/scratch/skscla001/experiments/datasets/swagen/audio/common_voice_sw_29787838.wav,vile vile nyangumi bluu anaweza kufikia uzito wa tani mia mbili 
/scratch/skscla001/experiments/datasets/swagen/audio/common_voice_sw_30122322.wav,nchini kenya ziwa lina ukubwa wa kilomita za mraba elfu nne na mia moja 
/scratch/skscla001/experiments/datasets/swagen/audio/common_voice_sw_30196669.wav,wilaya ya handeni mkoani tanga lugha yao huitwa kizigua 
/scratch/skscla001/experiments/datasets/swagen/audio/common_voice_sw_29794566.wav,kuendelea kupunguza tozo na kodi mbalimbali 
/scratch/skscla001/experiments/datasets/swagen/audio/common_voice_sw_36643704.wav,alielezea juu ya uwezo wa jacob kufanya matukio akiruka 
/scratch/skscla001/experiments/datasets/swagen/audio/common_voice_sw_36106128.wav,katika mwezi wa septemba msimu wa pukutisha huanza katika sehemu ya kaskazini mwa dunia na msimu wa chipukizi katika sehemu ya kusini 
/scratch/skscla001/experiments/datasets/swagen/audio/common_voice_sw_30380722.wav,timu ya taifa ya ufaransa ilikuwa inaogopeka 
/scratch/skscla001/experiments/datasets/swagen/audio/common_voice_sw_29795595.wav,kaunda alitangazwa kuwa raia wa nchi ya kigeni yaani msumbiji 
/scratch/skscla001/experiments/datasets/swagen/audio/common_voice_sw_34762824.wav,ulishinda nyingine na wimbo mwingine ulishinda tuzo nyingine 
/scratch/skscla001/experiments/datasets/swagen/audio/common_voice_sw_29795942.wav,watanzania tunaishi kwa upendo na umoja 
/scratch/skscla001/experiments/datasets/swagen/audio/common_voice_sw_29936801.wav,watalii wanaopenda kupanda milima watafurahia wakiwa tanzania 
/scratch/skscla001/experiments/datasets/swagen/audio/common_voice_sw_29923503.wav,wengi wamekuwa hawajui maana ya upendo 
/scratch/skscla001/experiments/datasets/swagen/audio/common_voice_sw_28670013.wav,kwa kweli utaratibu wa uchunguzi unaweza kuhusisha vipengele vya mbinu nyingi 
/scratch/skscla001/experiments/datasets/swagen/audio/common_voice_sw_30299454.wav,padre paul peter haule alipata daraja takatifu la ushemasi 
/scratch/skscla001/experiments/datasets/swagen/audio/common_voice_sw_30055159.wav,baada ya hifadhi ya kafue iliyopo nchini zambia 
/scratch/skscla001/experiments/datasets/swagen/audio/common_voice_sw_31791996.wav,pamoja na ile bandari ya mtwara kusini mwa nchi 
/scratch/skscla001/experiments/datasets/swagen/audio/common_voice_sw_28663274.wav,wengine wengi hawana dini yoyote 
/scratch/skscla001/experiments/datasets/swagen/audio/common_voice_sw_34993076.wav,naam ni msemaji wa tume ya umoja ulaya hellen kent 
/scratch/skscla001/experiments/datasets/swagen/audio/common_voice_sw_30631378.wav,baada ya kusaini alitoa haja yake na changamoto mpya kama sababu ya kuondoka realmadrid 
