audio	sentence
/scratch/skscla001/speech/data/swagen/audio/common_voice_sw_29937942.wav	wakati huo ikiwa tanganyika na ujerumani yenyewe wanakotokea akina hiss 
/scratch/skscla001/speech/data/swagen/audio/common_voice_sw_29000747.wav	matumizi mengine ni wakati wa kutoa mahubiri na mafundisho hata barabarani 
/scratch/skscla001/speech/data/swagen/audio/common_voice_sw_30201438.wav	watanzania ni watu tulivu wenye heshima na uvumulivu 
/scratch/skscla001/speech/data/swagen/audio/common_voice_sw_29936484.wav	wakati huo kamanda mpya mjerumani tom von prince alijenga boma jipya la wajerumani 
/scratch/skscla001/speech/data/swagen/audio/common_voice_sw_36385589.wav	ile mapenzi tunaendeleza katika 
/scratch/skscla001/speech/data/swagen/audio/common_voice_sw_30225322.wav	alianza kufanya mikataba na watawala wenyeji katika maeneo ya usagara nguru useguha na ukami 
/scratch/skscla001/speech/data/swagen/audio/common_voice_sw_36374892.wav	na mawaziri wa ulinzi kutoka nato wanaendelea na mkutano wao 
/scratch/skscla001/speech/data/swagen/audio/common_voice_sw_37219211.wav	almasi kila mwaka tumaini la kila mkristo 
/scratch/skscla001/speech/data/swagen/audio/common_voice_sw_30090675.wav	miaka kumi na tano iliyopita alivaa jezi ya barcelona kwa mara ya kwanza 
/scratch/skscla001/speech/data/swagen/audio/common_voice_sw_30121663.wav	rangi pia huonyesha dhana na vipengele muhimu katika tamaduni za wamasai 
/scratch/skscla001/speech/data/swagen/audio/common_voice_sw_29904643.wav	machozi na vilio vilitanda nchi mzima 
/scratch/skscla001/speech/data/swagen/audio/common_voice_sw_28660886.wav	kuna matoleo tofauti ya bunduki hizo 
/scratch/skscla001/speech/data/swagen/audio/common_voice_sw_29935100.wav	vikosi vya tanzania vilitakiwa kushinda mpambano huo ili viuteke mji mkuu wa uganda 
/scratch/skscla001/speech/data/swagen/audio/common_voice_sw_30025687.wav	kutokana na utaratibu huo kwa wamasai hakuna mgumba 
/scratch/skscla001/speech/data/swagen/audio/common_voice_sw_30257467.wav	walitawala bandari zote na njia kuu za meli 
/scratch/skscla001/speech/data/swagen/audio/common_voice_sw_37088586.wav	tunaona faraja ya kilimo hiki licha ya changamoto ya hali ya hewa inayotukabili 
/scratch/skscla001/speech/data/swagen/audio/common_voice_sw_36387987.wav	mlima huo uliopo mkoani kilimanjaro unatofautiana 
/scratch/skscla001/speech/data/swagen/audio/common_voice_sw_29936750.wav	platin alikuwa rais wa shirikisho la soka barani ulaya 
/scratch/skscla001/speech/data/swagen/audio/common_voice_sw_36374780.wav	utumiaji mkubwa wa pombe unaweza kusababisha kisukari 
/scratch/skscla001/speech/data/swagen/audio/common_voice_sw_29944863.wav	inayokamilisha jumla ya wilaya tatu za mkoa wa rukwa 
/scratch/skscla001/speech/data/swagen/audio/common_voice_sw_28820748.wav	hasa ni mlinzi wa kati anaweza pia kucheza kama beki wa pembeni 
/scratch/skscla001/speech/data/swagen/audio/common_voice_sw_28660773.wav	alishiriki katika tamthilia tofauti za televisheni nchini kenya 
/scratch/skscla001/speech/data/swagen/audio/common_voice_sw_28690222.wav	ana watoto watatu wawili wa kike na mmoja wa kiume 
/scratch/skscla001/speech/data/swagen/audio/common_voice_sw_36389396.wav	naam imetimia saa mbili na dakika thelathini na tatu kwa saa za afrika mashariki 
/scratch/skscla001/speech/data/swagen/audio/common_voice_sw_29942721.wav	kwenye miaka ya elfu moja mia saba hamsini 
/scratch/skscla001/speech/data/swagen/audio/common_voice_sw_29789326.wav	kuna wakati rais wa barcolona joan laporta aliwahi kusema 
/scratch/skscla001/speech/data/swagen/audio/common_voice_sw_29981997.wav	kumi alfredo stefano 
/scratch/skscla001/speech/data/swagen/audio/common_voice_sw_36381363.wav	herufi na mwaka vilikuwa vimeandikwa na kupangwa kwenye kila boksi 
/scratch/skscla001/speech/data/swagen/audio/common_voice_sw_28663195.wav	hali ambayo inatokea kila siku katika jamii yetu 
/scratch/skscla001/speech/data/swagen/audio/common_voice_sw_35280771.wav	kuwa hatua ambayo wakati wa saddam hussein hatukuwa 
/scratch/skscla001/speech/data/swagen/audio/common_voice_sw_30114483.wav	mkia wake hummpa msaada mkubwa katika mwili pamoja kwamba hukimbia kwa kunesa 
/scratch/skscla001/speech/data/swagen/audio/common_voice_sw_30021648.wav	nicky oppenheimer wa afrika kusini akiwa na utajiri wa dola bilioni nane 
/scratch/skscla001/speech/data/swagen/audio/common_voice_sw_29637922.wav	ilikuwa kituo cha posta na pia cha kikosi na 
/scratch/skscla001/speech/data/swagen/audio/common_voice_sw_30514671.wav	meneja wa machimbo hayo alikuwa mwingereza alikubali na akatuma timu yake ya wataalamu 
/scratch/skscla001/speech/data/swagen/audio/common_voice_sw_35683994.wav	filamu inaelezea hadithi iliyotungwa na mwandishi 
/scratch/skscla001/speech/data/swagen/audio/common_voice_sw_29630041.wav	maji yake yanaelekea bahari ya hindi kupitia mto pangani 
/scratch/skscla001/speech/data/swagen/audio/common_voice_sw_30629020.wav	hii inaweza ikaonekana kuwa ngumu kufanya 
/scratch/skscla001/speech/data/swagen/audio/common_voice_sw_29615734.wav	uchungu wa mauti ni dhambi na nguvu za dhambi ni torati 
/scratch/skscla001/speech/data/swagen/audio/common_voice_sw_30470955.wav	upande mmoja zilikuwa nchi zilizoshikama na taifa la marekani 
/scratch/skscla001/speech/data/swagen/audio/common_voice_sw_29980257.wav	wangoni hawaoi mke au kuolewa na mume mwenye ubini mmoja 
/scratch/skscla001/speech/data/swagen/audio/common_voice_sw_36383669.wav	hususani katika sehemu za kusini mwa marekani 
/scratch/skscla001/speech/data/swagen/audio/common_voice_sw_30327384.wav	hapo wakaingia wajerumani waliokuwa na mapatano ya usaidizi na hungaria 
/scratch/skscla001/speech/data/swagen/audio/common_voice_sw_37099611.wav	afu ukapata na viazi vya kuchemsha kama vinne 
/scratch/skscla001/speech/data/swagen/audio/common_voice_sw_29993847.wav	alichuana tena na karume katika nafasi ya urais wa zanzibari 
/scratch/skscla001/speech/data/swagen/audio/common_voice_sw_29946566.wav	sultani majid bin said kuhamia dar es salaam mwaka huo 
/scratch/skscla001/speech/data/swagen/audio/common_voice_sw_30021847.wav	mambo yakawa dhahiri nyerere alikuwa amewatangazia vita 
/scratch/skscla001/speech/data/swagen/audio/common_voice_sw_29822904.wav	uchumi unaonekana kunawiri kwa kasi mno 
/scratch/skscla001/speech/data/swagen/audio/common_voice_sw_36381999.wav	nimepaka ukuta rangi 
/scratch/skscla001/speech/data/swagen/audio/common_voice_sw_31305366.wav	ambao hawalimi wala kufanya aina yeyote ya kilimo 
/scratch/skscla001/speech/data/swagen/audio/common_voice_sw_31306615.wav	kupambana kwa ajili ya kuwatangaza mchezo pesa kimataifa 
/scratch/skscla001/speech/data/swagen/audio/common_voice_sw_36373567.wav	aa hatujawahi kuzoea kuona 
/scratch/skscla001/speech/data/swagen/audio/common_voice_sw_34746429.wav	mada zako zinatakiwa kugusa mahitaji ya wasikilizaji wako 
/scratch/skscla001/speech/data/swagen/audio/common_voice_sw_37229919.wav	ni maendeleo ya kila namna kwa hiyo wawe makini wasifanye tu ili mradi wameamua 
/scratch/skscla001/speech/data/swagen/audio/common_voice_sw_36381701.wav	mgonjwa wa kisukari anahitaji uangalizi wa karibu sana 
/scratch/skscla001/speech/data/swagen/audio/common_voice_sw_36385253.wav	hivi ndivyo mwanaadamu wa kweli mwenye kujuwa thamani yake na nchi yake anavyopasa kuwa 
/scratch/skscla001/speech/data/swagen/audio/common_voice_sw_30020162.wav	kuwa na hidarati ni lazima kama una matumaini ya kufika mbali 
/scratch/skscla001/speech/data/swagen/audio/common_voice_sw_30630020.wav	nyerere alihimiza utaifa wa waafrika wote 
/scratch/skscla001/speech/data/swagen/audio/common_voice_sw_30376090.wav	matokeo hayo yalithibitisha afya ya wamoran 
/scratch/skscla001/speech/data/swagen/audio/common_voice_sw_29937834.wav	ni moja ya mambo yaliyoenezwa na wachagga 
/scratch/skscla001/speech/data/swagen/audio/common_voice_sw_30365386.wav	katika muda wa miongo mitatu tu ameweza kujenga timu imara 
/scratch/skscla001/speech/data/swagen/audio/common_voice_sw_30470848.wav	vilevile eneo hili limewekwa kwa ajili ya wachimbaji wadogo wadogo wa almasi 
/scratch/skscla001/speech/data/swagen/audio/common_voice_sw_29862545.wav	mwelekeo wa ujamaa wa baadhi katika serikali mpya 
/scratch/skscla001/speech/data/swagen/audio/common_voice_sw_29981607.wav	misongamano ya watu kwenye daladala ilipungua 
/scratch/skscla001/speech/data/swagen/audio/common_voice_sw_34391066.wav	jiwe lilipigwa na kupunguzwa pande zote mbili 
/scratch/skscla001/speech/data/swagen/audio/common_voice_sw_30201437.wav	mgogoro ulipozidi kukua mashambulizi yakahama sasa 
/scratch/skscla001/speech/data/swagen/audio/common_voice_sw_37096495.wav	dhiti ya mwimbaji maarufu michele mati 
/scratch/skscla001/speech/data/swagen/audio/common_voice_sw_30380504.wav	cha kushangaza ni kwamba jina nelson siyo jina alilopewa na wazazi wake 
/scratch/skscla001/speech/data/swagen/audio/common_voice_sw_29941625.wav	wengi wa nyumbu hawakuvuka juni kama ilivyo kawaida kutokana na moto uliowashwa porini 
/scratch/skscla001/speech/data/swagen/audio/common_voice_sw_29939177.wav	pamoja na mfumo wa chama kimoja cha siasa na muundo wa serikali mbili 
/scratch/skscla001/speech/data/swagen/audio/common_voice_sw_29142294.wav	lakini single hii haikuwa na video yake 
/scratch/skscla001/speech/data/swagen/audio/common_voice_sw_37097520.wav	kuanzia mwaka elfu moja mia saba themanini na nne 
/scratch/skscla001/speech/data/swagen/audio/common_voice_sw_30586136.wav	nchi nyingi hujivunia utawala wa serikali ya nchi ya tanzania 
/scratch/skscla001/speech/data/swagen/audio/common_voice_sw_30020875.wav	kikosi chake kilihudhuria katika juhudi za kupambana na wanamgambo wa maumau 
/scratch/skscla001/speech/data/swagen/audio/common_voice_sw_37222778.wav	aidha alipata mafunzo mbalimbali katika taasisi ya chuo cha utawala wa umma lahore pakistan 
/scratch/skscla001/speech/data/swagen/audio/common_voice_sw_36374931.wav	hakika tutajenga jamii yenye amani upendo na kujiamini kwa raia na mali zao 
/scratch/skscla001/speech/data/swagen/audio/common_voice_sw_29887539.wav	ipo mipaka ya ardhini kwa maana ya nchi kavu 
/scratch/skscla001/speech/data/swagen/audio/common_voice_sw_29936663.wav	giacinto facchetti alitajwa kwenye orodha ya wachezaji bora duniani 
/scratch/skscla001/speech/data/swagen/audio/common_voice_sw_30181691.wav	virusi hivi vilipewa jina la ukimwi vilipogunduliwa nchini marekani 
/scratch/skscla001/speech/data/swagen/audio/common_voice_sw_30008465.wav	maalim self ataendelea kukumbukwa kama jabali wa siasa za harakati visiwani zanzibari 
/scratch/skscla001/speech/data/swagen/audio/common_voice_sw_28690310.wav	ina shule moja ya sekondari 
/scratch/skscla001/speech/data/swagen/audio/common_voice_sw_30180336.wav	ndio maana watu wengine wanadhani wanapenda kesi 
/scratch/skscla001/speech/data/swagen/audio/common_voice_sw_36389637.wav	sifa kwa yesu 
/scratch/skscla001/speech/data/swagen/audio/common_voice_sw_28690429.wav	njia mojawapo ya ibada 
/scratch/skscla001/speech/data/swagen/audio/common_voice_sw_36381666.wav	linawezesha utekelezaji wa maendeleo endelevu kwenye nyanja ya mazingira 
/scratch/skscla001/speech/data/swagen/audio/common_voice_sw_29993782.wav	sabasaba ni maadhimisho yanayofanyika kila mwaka nchini tanzania 
/scratch/skscla001/speech/data/swagen/audio/common_voice_sw_36616995.wav	marehemu kenyatta alikuwa rais mwenye maarifa 
/scratch/skscla001/speech/data/swagen/audio/common_voice_sw_30342769.wav	kushinda kombe la dunia sio jambo rahisi 
/scratch/skscla001/speech/data/swagen/audio/common_voice_sw_30020275.wav	virusi wanaosababisha ugonjwa wa dengua 
/scratch/skscla001/speech/data/swagen/audio/common_voice_sw_30583030.wav	hakika wapare ni mfano wa kuigwa hapa nchini 
/scratch/skscla001/speech/data/swagen/audio/common_voice_sw_30323877.wav	mito hii inakusanya maji yake kwenye tambarare ya usangu na ndipo ruaha inapoanza 
/scratch/skscla001/speech/data/swagen/audio/common_voice_sw_30117840.wav	malaika alipogeuka na kufanya matendo ya kigaidi 
/scratch/skscla001/speech/data/swagen/audio/common_voice_sw_36049833.wav	hautahitaji gari katika kutembelea hifadhi hiyo 
/scratch/skscla001/speech/data/swagen/audio/common_voice_sw_29796842.wav	watu wanaamini kuwa mashindano ya urembo hayana maana 
/scratch/skscla001/speech/data/swagen/audio/common_voice_sw_31407009.wav	huku yeye akiitwa warsaw akutane na mkuu wa maaskofu wa uholanzi 
/scratch/skscla001/speech/data/swagen/audio/common_voice_sw_31409242.wav	amekuwa kiongozi bora kwa kila mtu hapa nchini 
/scratch/skscla001/speech/data/swagen/audio/common_voice_sw_29945322.wav	mfugale alizaliwa ifunda mkoani iringa 
/scratch/skscla001/speech/data/swagen/audio/common_voice_sw_28681176.wav	ukubwa wa darfur ni kama ule wa ufaransa 
/scratch/skscla001/speech/data/swagen/audio/common_voice_sw_36375120.wav	kuzima koleo si mwisho wa uhunzi 
/scratch/skscla001/speech/data/swagen/audio/common_voice_sw_34764221.wav	wasema ni wa luobaadhi ya jamii ya wajaluo wanaoaminika kwamba walikuwa wabantu na 
/scratch/skscla001/speech/data/swagen/audio/common_voice_sw_30313899.wav	kwa sababu hiyo wameru wanasikilizana sana na wamachame 
/scratch/skscla001/speech/data/swagen/audio/common_voice_sw_29903266.wav	majengo yenye usanifu wa kiarabu kihindi na kijerumani yanastahiki kuwa ya kihistoria 
/scratch/skscla001/speech/data/swagen/audio/common_voice_sw_30025836.wav	baadhi yao wanaendelea na ushirikina kama zilivyo sehemu nyingine nchini 
/scratch/skscla001/speech/data/swagen/audio/common_voice_sw_36383870.wav	uokoaji wa watu sita katika kundi la watu nane ni takwimu nzuri 
/scratch/skscla001/speech/data/swagen/audio/common_voice_sw_30019876.wav	karume alikuwa makamu wa rais wa kwanza wa jamhuri ya muungano wa tanzania 
/scratch/skscla001/speech/data/swagen/audio/common_voice_sw_31304496.wav	taifa la liberia liliwahi kutoa mwanasoka bora wa dunia 
/scratch/skscla001/speech/data/swagen/audio/common_voice_sw_31369755.wav	kikosi chake kilianyanganywa silaha zote alizokuwa anamiliki 
/scratch/skscla001/speech/data/swagen/audio/common_voice_sw_30650337.wav	shughuli za kufanya hifadhini saanane ni pamoja na kuangalia wanyama 
/scratch/skscla001/speech/data/swagen/audio/common_voice_sw_30201817.wav	klabu ya mpira wa miguu ya azam ikapokea na kuwaacha wana msimbazi wakibaki watazamaji 
/scratch/skscla001/speech/data/swagen/audio/common_voice_sw_36390709.wav	sheria na haki za binadamu nchini tanzania 
/scratch/skscla001/speech/data/swagen/audio/common_voice_sw_29796288.wav	waoman wakafuatiliwa kwa karibu na wamishionari wa kikristo 
/scratch/skscla001/speech/data/swagen/audio/common_voice_sw_29862357.wav	kwenye nembo ya taifa kuna alama ya jembe na mkuki 
/scratch/skscla001/speech/data/swagen/audio/common_voice_sw_36945152.wav	ilikuwa inahatarisha maisha ya vikundi vya kimataifa 
/scratch/skscla001/speech/data/swagen/audio/common_voice_sw_36373692.wav	lakini ilinyakuliwa mwaka wa elfu moja na mia tisa na tano 
/scratch/skscla001/speech/data/swagen/audio/common_voice_sw_30434932.wav	kadri mvua zinavyopungua ndivyo uoto wa asili unavyopungua 
/scratch/skscla001/speech/data/swagen/audio/common_voice_sw_30647712.wav	ameichezea ufaransa michezo mia moja na nane akifumania nyavu mara thelathini na moja 
/scratch/skscla001/speech/data/swagen/audio/common_voice_sw_30148626.wav	hispania ilitwaa kombe la kwanza kwenye historia ya nchi yao 
/scratch/skscla001/speech/data/swagen/audio/common_voice_sw_29943373.wav	kwa sababu vinatumia mafuta mengi ya kutoka viwandani 
/scratch/skscla001/speech/data/swagen/audio/common_voice_sw_29796249.wav	soka ya taifa ya ufukweni na timu za soka za taifa za vijana 
/scratch/skscla001/speech/data/swagen/audio/common_voice_sw_37099006.wav	nafasi za juu au hata ikiwezekana nafasi moja kati ya zile mbili 
/scratch/skscla001/speech/data/swagen/audio/common_voice_sw_28581953.wav	utumbo mwembamba ni mrefu kuliko ogani nyingine yoyote ya njia ya chakula 
/scratch/skscla001/speech/data/swagen/audio/common_voice_sw_30671883.wav	macho mekundi si ishara ya uchawi usukumani ila imepotoshwa sana 
/scratch/skscla001/speech/data/swagen/audio/common_voice_sw_29944859.wav	ni mchezaji wa pili katika historia ya kupiga fainali mbili za kombe la mabingwa 
/scratch/skscla001/speech/data/swagen/audio/common_voice_sw_31326697.wav	dunia aliwapa brazil ubingwa wa mwisho wa kombe la dunia 
/scratch/skscla001/speech/data/swagen/audio/common_voice_sw_30182541.wav	ziwa tanganyika lilikuwa chini ya utawala wa sultani 
/scratch/skscla001/speech/data/swagen/audio/common_voice_sw_31409225.wav	argentina waliwafunga brazil kwenye fainali za kopa amerika 
/scratch/skscla001/speech/data/swagen/audio/common_voice_sw_29982089.wav	ya vyungu vya zanzibar 
/scratch/skscla001/speech/data/swagen/audio/common_voice_sw_30380689.wav	hakikisha ngozi yako inakuwa safi muda wote 
/scratch/skscla001/speech/data/swagen/audio/common_voice_sw_30419818.wav	ni miongoni mwa makabila yanayojulikana zaidi hata nje ya afrika 
/scratch/skscla001/speech/data/swagen/audio/common_voice_sw_28716319.wav	hali ya vita na hispania iliendelea 
/scratch/skscla001/speech/data/swagen/audio/common_voice_sw_29902475.wav	na kuchapa kazi na pia kusimamia vyema nyumba yake 
/scratch/skscla001/speech/data/swagen/audio/common_voice_sw_30628324.wav	kwa kawaida malindi umekuwa mji na bandari ya kirafiki 
/scratch/skscla001/speech/data/swagen/audio/common_voice_sw_30026685.wav	inaongezeka halmashauri ya wilaya ya rombo na halmashauri ya wilaya ya hai 
/scratch/skscla001/speech/data/swagen/audio/common_voice_sw_37088308.wav	urusi walianzisha sera ya operesheni maambukizi katika kukabiliana na ukimwi 
/scratch/skscla001/speech/data/swagen/audio/common_voice_sw_28735776.wav	sensa ya kirumi ulifanyika kila miaka mitano 
/scratch/skscla001/speech/data/swagen/audio/common_voice_sw_31304305.wav	nyumbu huzaliana sana na kufikia nyumbu laki tano wanaozaliwa kwa mwaka 
/scratch/skscla001/speech/data/swagen/audio/common_voice_sw_30233704.wav	tanzania ingekuwa na mto unaotoa maji ziwa nyasa ingekuwa na fursa nyingi za ajira 
/scratch/skscla001/speech/data/swagen/audio/common_voice_sw_30630892.wav	kimsingi kuna sekta kumi na mbili za kabila la wamasai 
/scratch/skscla001/speech/data/swagen/audio/common_voice_sw_30631041.wav	aligundua kuwa raia huyo wa seychelles hakuhusika kulipua daraja hilo 
/scratch/skscla001/speech/data/swagen/audio/common_voice_sw_30090673.wav	mma huondoa bangili ya mtoto na sherehe huisha 
/scratch/skscla001/speech/data/swagen/audio/common_voice_sw_30478522.wav	bayern ikaendelea kutwaa makombe ya ndani kila msimu 
/scratch/skscla001/speech/data/swagen/audio/common_voice_sw_30319991.wav	ulisimamiwa na aliyekuwa mkuu wa mkoa wa ruvuma daktari christine ishengoma 
/scratch/skscla001/speech/data/swagen/audio/common_voice_sw_36386002.wav	ulifanya kazi gani 
/scratch/skscla001/speech/data/swagen/audio/common_voice_sw_29789389.wav	aliolewa mwaka mmoja baada ya kumaliza masomo hayo 
/scratch/skscla001/speech/data/swagen/audio/common_voice_sw_30180828.wav	kondoo dume huchinjwa siku ya harusi kuondoa mafuta ambayo yatapakwa kwenye mavazi ya harusi 
/scratch/skscla001/speech/data/swagen/audio/common_voice_sw_29934945.wav	watu waliopinga zaidi vita dhidi ya taifa la iraq 
/scratch/skscla001/speech/data/swagen/audio/common_voice_sw_29897878.wav	matukio ya kwanza yalikuwa katika kikundi kidogo cha waraibu wa dawa za kulevya 
/scratch/skscla001/speech/data/swagen/audio/common_voice_sw_36807760.wav	kuwait na marekani vita vya pili vya ghuba ya elfu mbili na tatu 
/scratch/skscla001/speech/data/swagen/audio/common_voice_sw_30735709.wav	hubadilisha rangi kutoka samawati hadi nyeusi na kufanana na washing soda 
/scratch/skscla001/speech/data/swagen/audio/common_voice_sw_28690165.wav	ni ndugu mapacha sawa 
/scratch/skscla001/speech/data/swagen/audio/common_voice_sw_29899274.wav	ukosefu wa miundombinu bora ya kuwawezesha kujikita katika kilimo ndiyo changamoto inayowakabili 
/scratch/skscla001/speech/data/swagen/audio/common_voice_sw_37223773.wav	shirika kama royal niger company zilipata maeneo 
/scratch/skscla001/speech/data/swagen/audio/common_voice_sw_36382016.wav	kuuzwa nje ya nchi kama watumwa 
/scratch/skscla001/speech/data/swagen/audio/common_voice_sw_30577589.wav	umarufu huo unatokana na vitu mbalimbali vilivyomo wilayani humo ikiwemo mapango ya kale 
/scratch/skscla001/speech/data/swagen/audio/common_voice_sw_28581915.wav	kipande cha chini ni kama tumbo 
/scratch/skscla001/speech/data/swagen/audio/common_voice_sw_29947060.wav	anne makinda amewataka wanawake nchini kuacha woga wakati wa mapambano 
/scratch/skscla001/speech/data/swagen/audio/common_voice_sw_28690387.wav	wafalme waliwahi kutumia pesa vibaya na nchi ilikuwa na madeni makubwa 
/scratch/skscla001/speech/data/swagen/audio/common_voice_sw_29636736.wav	makao makuu yake ni dar es salaam 
/scratch/skscla001/speech/data/swagen/audio/common_voice_sw_29941447.wav	uwindaji haramu wanyamapori na ukosefu wa moto ambapo yalikuwa matokeo ya shughuli za binadamu 
/scratch/skscla001/speech/data/swagen/audio/common_voice_sw_30182507.wav	jambo la ajabu kwenye gofu hilo wapo nyuki waliojenga kwenye pango 
/scratch/skscla001/speech/data/swagen/audio/common_voice_sw_35684227.wav	kwani mamlaka nchini china haziku mruhusu kutoka nje ya gereza 
/scratch/skscla001/speech/data/swagen/audio/common_voice_sw_30046144.wav	safari za mtubwi katika ziwa eyasi 
/scratch/skscla001/speech/data/swagen/audio/common_voice_sw_30257237.wav	wakati meli ikizama kulikuwa na uhaba wa boti za kuokolea 
/scratch/skscla001/speech/data/swagen/audio/common_voice_sw_36381104.wav	ambayo usingeweza hata kupata kuyauliza lakini unahitaji 
/scratch/skscla001/speech/data/swagen/audio/common_voice_sw_35376808.wav	vya ukolezi ambavyo viko juu sana vikiwa karibu na vyanzo vyake 
/scratch/skscla001/speech/data/swagen/audio/common_voice_sw_30147239.wav	mikoa ya mwambao wa pwani imeanza ufugaji wa kondoo 
/scratch/skscla001/speech/data/swagen/audio/common_voice_sw_30024727.wav	hatua ya kwanza inawezekana ikawa katika kuwania tuzo ya mchezaji bora wa mwezi 
/scratch/skscla001/speech/data/swagen/audio/common_voice_sw_30574654.wav	wafungaji bora wa michuano ya kwanza ya ulaya walikuwa wawili 
/scratch/skscla001/speech/data/swagen/audio/common_voice_sw_30122764.wav	ambao aina mbalimbali za samaki na mamba pia viboko hupatikana katika mto huu 
/scratch/skscla001/speech/data/swagen/audio/common_voice_sw_30020863.wav	halikadhalika kidoti cheusi kinachoshirikishwa na urembo kilichopo usoni mwake 
/scratch/skscla001/speech/data/swagen/audio/common_voice_sw_29995704.wav	kunyongwa kisheria hakujulikani na malipo ya kawaida kwa ngombe hutosheleza mambo 
/scratch/skscla001/speech/data/swagen/audio/common_voice_sw_29236652.wav	hata hivyo kundinyota hili lilianzishwa nyakati za kale huko misri 
/scratch/skscla001/speech/data/swagen/audio/common_voice_sw_30635726.wav	kujadili jambo hilo na kuridhika kuwa idi amin alitumiwa na mataifa mengine 
/scratch/skscla001/speech/data/swagen/audio/common_voice_sw_30365390.wav	mpango huu ulielekezwa zaidi huko ulaya na marekani kulikokuwa na wanunuzi wa watumwa hao 
/scratch/skscla001/speech/data/swagen/audio/common_voice_sw_30024976.wav	engai narok mungu mweusi ana huruma na engai nanyokie mungu mwekundu ana ghadhabu 
/scratch/skscla001/speech/data/swagen/audio/common_voice_sw_30200966.wav	kulingana na serikali za nchi na nyingine zinapotea zenyewe taratibu 
/scratch/skscla001/speech/data/swagen/audio/common_voice_sw_35410987.wav	shinikizo la seljuks na mongols baadhi ya waturuki 
/scratch/skscla001/speech/data/swagen/audio/common_voice_sw_29795237.wav	ujasiri ni wosia wanaotembea nao kila uchao 
/scratch/skscla001/speech/data/swagen/audio/common_voice_sw_30057881.wav	hufuga punda ndogowe kwa ajili ya ubebaji mizigo na 
/scratch/skscla001/speech/data/swagen/audio/common_voice_sw_31440768.wav	imepoteza fainali ya ulaya kwa chelsea 
/scratch/skscla001/speech/data/swagen/audio/common_voice_sw_30365269.wav	sasa tuangalie urefu wa kilomita za kutoka sehemu moja kwenda nyingine 
/scratch/skscla001/speech/data/swagen/audio/common_voice_sw_29936803.wav	mwaka elfu mbili na tano aliteuliwa kuwa waziri hadi mwaka elfu mbili na kumi 
/scratch/skscla001/speech/data/swagen/audio/common_voice_sw_30020633.wav	hifadhi ya mikumi ni moja kati ya hifadhi za taifa na mashuhuri 
/scratch/skscla001/speech/data/swagen/audio/common_voice_sw_37223035.wav	sayansi na afya unahitajikalicha ya makubaliano mapana ya 
/scratch/skscla001/speech/data/swagen/audio/common_voice_sw_30582940.wav	pesa ikiwepo hakuna anayekataa kufanya kazi 
/scratch/skscla001/speech/data/swagen/audio/common_voice_sw_30021781.wav	kayuni hakuishi litembo maisha yake yote lakini alizaliwa katika ardhi ya litembo 
/scratch/skscla001/speech/data/swagen/audio/common_voice_sw_28661893.wav	kamerun ilikuwa koloni la ujerumani hadi vita kuu ya kwanza ya dunia 
/scratch/skscla001/speech/data/swagen/audio/common_voice_sw_28814702.wav	kufuatana na uainishaji wa lugha kwa ndani zaidi kimur pano iko katika kundi la kioseaniki 
/scratch/skscla001/speech/data/swagen/audio/common_voice_sw_37090771.wav	alikasirika sana juzi 
/scratch/skscla001/speech/data/swagen/audio/common_voice_sw_36043525.wav	joseph kusaga mkurugenzi na mmliki wa chombo cha clouds 
/scratch/skscla001/speech/data/swagen/audio/common_voice_sw_30634525.wav	anarudia ulinganifu kati ya makundi ya wakaazi mbalimbali 
/scratch/skscla001/speech/data/swagen/audio/common_voice_sw_36807495.wav	makuu ni moscow na sankt peterburg moscow 
/scratch/skscla001/speech/data/swagen/audio/common_voice_sw_29997083.wav	alijenga nyumba za wazee wasiojiweza huko sebleni 
/scratch/skscla001/speech/data/swagen/audio/common_voice_sw_29942699.wav	kukua kwa zanzibar kulisababisha kukonda kwa mji wa maskat 
/scratch/skscla001/speech/data/swagen/audio/common_voice_sw_30376329.wav	pia wale wanaosafirisha mizigo kupeleka nje ya nchi 
/scratch/skscla001/speech/data/swagen/audio/common_voice_sw_36254111.wav	kwani hula wanyama ambao wamelisha kwenye mchanga huu uliochafuliwa 
