audio	sentence
/scratch/skscla001/speech/data/swagen/audio/common_voice_sw_29996021.wav	miradi inayoendelea kufanyika pia ilionekana kwenye kurasa za magazeti 
/scratch/skscla001/speech/data/swagen/audio/common_voice_sw_30661156.wav	chanjo dhidi ya homa ya ini hutolewa kwa watoto wote 
/scratch/skscla001/speech/data/swagen/audio/common_voice_sw_35412157.wav	alaa amekuja saa ngapi 
/scratch/skscla001/speech/data/swagen/audio/common_voice_sw_36350081.wav	yeye huoga mara tano kwa siku 
/scratch/skscla001/speech/data/swagen/audio/common_voice_sw_28999522.wav	hasa mlimani na penye matope si mahali pake 
/scratch/skscla001/speech/data/swagen/audio/common_voice_sw_30380564.wav	barabara ya bibi titi iliyopo dar es salaam 
/scratch/skscla001/speech/data/swagen/audio/common_voice_sw_30365218.wav	utalii wa kidini ni utalii mzuri ambapo watu 
/scratch/skscla001/speech/data/swagen/audio/common_voice_sw_36807759.wav	awali mpinzani mkubwa bonny ayai adeehu benji 
/scratch/skscla001/speech/data/swagen/audio/common_voice_sw_29797120.wav	wakavuka bahari na kuajiri mahamali wakarudi miezi au miaka kadhaa 
/scratch/skscla001/speech/data/swagen/audio/common_voice_sw_36255328.wav	inayoitwa tepui katika lugha ya wakazi asilia 
/scratch/skscla001/speech/data/swagen/audio/common_voice_sw_35132553.wav	anatakiwa kulala ndani ya vyandarua vyenye dawa 
/scratch/skscla001/speech/data/swagen/audio/common_voice_sw_28682168.wav	inapatikana katika hali na ukubwa mbalimbali 
/scratch/skscla001/speech/data/swagen/audio/common_voice_sw_30149276.wav	utulivu na mandhari ya kisiwa ni ngao muhimu ya kuwavuta watalii 
/scratch/skscla001/speech/data/swagen/audio/common_voice_sw_30142782.wav	alivyoingia kidato cha tano na sita alichukua masomo ya historia jiografia na uchumi 
/scratch/skscla001/speech/data/swagen/audio/common_voice_sw_28583029.wav	hali ya hewa ya siberia ni kali sana 
/scratch/skscla001/speech/data/swagen/audio/common_voice_sw_29937965.wav	vile vile hata majina na baadhi ya maeneo yaliyopo kwa wapare 
/scratch/skscla001/speech/data/swagen/audio/common_voice_sw_30365413.wav	nadharia huendelea mbele na wazo la vipengele vingine 
/scratch/skscla001/speech/data/swagen/audio/common_voice_sw_30671558.wav	uingereza walikuwa na timu imara sana duniani 
/scratch/skscla001/speech/data/swagen/audio/common_voice_sw_30671087.wav	nyerere alianzisha maonesho ya kilimo na sherehe za wakulima 
/scratch/skscla001/speech/data/swagen/audio/common_voice_sw_36385838.wav	tangu mwishoni mwa miaka ya elfu moja mia tisa na sabini 
/scratch/skscla001/speech/data/swagen/audio/common_voice_sw_36299638.wav	huko kiwanja ni kizuri 
/scratch/skscla001/speech/data/swagen/audio/common_voice_sw_30671884.wav	wakati uleule mishale ya jua husababisha kupotea kwa theluji na barafu 
/scratch/skscla001/speech/data/swagen/audio/common_voice_sw_36386408.wav	aliendelea kuendesha akifuatilia mahali ulipotokea ule mkito wa muziki 
/scratch/skscla001/speech/data/swagen/audio/common_voice_sw_30364015.wav	twiga wanajihami kwa teke la nguvu 
/scratch/skscla001/speech/data/swagen/audio/common_voice_sw_29434006.wav	yeye ni mwanachama wa democratic farmer labor party 
/scratch/skscla001/speech/data/swagen/audio/common_voice_sw_37223449.wav	dhidi hispania ilijipatia utawala juu ya ufilipino 
/scratch/skscla001/speech/data/swagen/audio/common_voice_sw_30026011.wav	vasco da gama alikuwa amezuru mombasa mwaka wa elfumoja mianne tisini na nane 
/scratch/skscla001/speech/data/swagen/audio/common_voice_sw_36382277.wav	na kumla kila niliposimama na kutayarisha sehemu ya 
/scratch/skscla001/speech/data/swagen/audio/common_voice_sw_30025533.wav	mtala ni jina la ukoo wa baba ambalo ndilo analoitwa mtoto 
/scratch/skscla001/speech/data/swagen/audio/common_voice_sw_30478558.wav	mwili kuuma mkojo kuwa na rangi iliyokolea kama cocacola 
/scratch/skscla001/speech/data/swagen/audio/common_voice_sw_30364428.wav	maji kwenye mito inapungua kutokana na mvukizo 
/scratch/skscla001/speech/data/swagen/audio/common_voice_sw_29605527.wav	kutokana na nusu zake alianzisha mbingu na nchi 
/scratch/skscla001/speech/data/swagen/audio/common_voice_sw_29950332.wav	wagonjwa nane hadi kumi hufa hata baada ya matibabu kwa kutumia antibiotiki 
/scratch/skscla001/speech/data/swagen/audio/common_voice_sw_36310737.wav	jina la bight of bonny iliendelea kuwa moja kati ya vituo vya 
/scratch/skscla001/speech/data/swagen/audio/common_voice_sw_29333345.wav	mamba hupenda kuishi katika maji baridi kama vile maziwa mito ardhi tepe tepe 
/scratch/skscla001/speech/data/swagen/audio/common_voice_sw_29725993.wav	mara nyingi kuna wabunge wa kuchaguliwa na wale wa kuteuliwa 
/scratch/skscla001/speech/data/swagen/audio/common_voice_sw_35377284.wav	malawi cha malawi chama congress ambacho kiliitawala nchi hiyo ya kusini mwa afrika kuanzia 
/scratch/skscla001/speech/data/swagen/audio/common_voice_sw_30635644.wav	wenzao wa kisomailia kwa rangi yao 
/scratch/skscla001/speech/data/swagen/audio/common_voice_sw_29796007.wav	baada ya hapo likaendesha operesheni ya kupora mali za watu 
/scratch/skscla001/speech/data/swagen/audio/common_voice_sw_31322339.wav	kiutawala jiji limegawanyika katika halmashauri sita za serikali za mitaa 
/scratch/skscla001/speech/data/swagen/audio/common_voice_sw_29957345.wav	mwandishi wa habari anaweza kuandika insha 
/scratch/skscla001/speech/data/swagen/audio/common_voice_sw_30381905.wav	mungu akapanga yaliyo mapenzi yake katika taarifa iliyotikisa nchi yetu ya tanzania 
/scratch/skscla001/speech/data/swagen/audio/common_voice_sw_30661060.wav	hali hii imepelekea kuyumba kimtaji na kushindwa kuendeleza biashara 
/scratch/skscla001/speech/data/swagen/audio/common_voice_sw_29795419.wav	tunatakiwa tutunze misitu kwa ajili ya manufaa yetu wenyewe na vizazi vingine 
/scratch/skscla001/speech/data/swagen/audio/common_voice_sw_30180734.wav	mandela yuko huru sasa anaamua kusaka uungwaji mkono 
/scratch/skscla001/speech/data/swagen/audio/common_voice_sw_28581773.wav	ni mji upande wa kati ya jimbo mexico na pia nchi mexiko 
/scratch/skscla001/speech/data/swagen/audio/common_voice_sw_29899447.wav	pep alipumzika kwa muwa wa mwaka 
/scratch/skscla001/speech/data/swagen/audio/common_voice_sw_28971638.wav	chaji hizi mbili ni kinyume zinaitwa chaji hasi na chaji chanya 
/scratch/skscla001/speech/data/swagen/audio/common_voice_sw_37086819.wav	kinjekitile alilaghai watu kwamba yeye anafahamu sayansi ya kijadi 
/scratch/skscla001/speech/data/swagen/audio/common_voice_sw_36331603.wav	na roma ya kale waberber walisimama upande wa 
/scratch/skscla001/speech/data/swagen/audio/common_voice_sw_36387321.wav	ili mwanaume pia apendezewe na mke wake ndani ya nyumba 
/scratch/skscla001/speech/data/swagen/audio/common_voice_sw_30402901.wav	mwanamke huyo ambaye ametajwa kuwa mwanamke tajiri zaidi barani afrika 
/scratch/skscla001/speech/data/swagen/audio/common_voice_sw_30025030.wav	theodoros zagora ndiye aliyekuwa nyota wa ugiriki 
/scratch/skscla001/speech/data/swagen/audio/common_voice_sw_30342714.wav	pamoja na vile vikosi vya mapinduzi nchini ghana 
/scratch/skscla001/speech/data/swagen/audio/common_voice_sw_29815848.wav	anapooa huitwa samachau na anaeolewa wanamachau 
/scratch/skscla001/speech/data/swagen/audio/common_voice_sw_29898411.wav	kabla ya kuhamia klabu ya feberbahce uturuki alikuwa akichezea aston villa timu ya uingereza 
/scratch/skscla001/speech/data/swagen/audio/common_voice_sw_29937635.wav	baadhi wa wanajeshi wa amin waliogopa kukabiliana na majeshi hayo ya kigeni 
/scratch/skscla001/speech/data/swagen/audio/common_voice_sw_29938218.wav	aliporejea tanganyika kutoka masomoni nyerere alifundisha historia kingereza na kiswahili 
/scratch/skscla001/speech/data/swagen/audio/common_voice_sw_30439737.wav	marekani ndege za nchi hiyo zenye raia wake na 
/scratch/skscla001/speech/data/swagen/audio/common_voice_sw_29977595.wav	hivi majuzi nilibahatika kufika katika mji wa kilwa kisiwani ulioko mkoani lindi 
/scratch/skscla001/speech/data/swagen/audio/common_voice_sw_28669378.wav	uislamu ndio dini rasmi 
/scratch/skscla001/speech/data/swagen/audio/common_voice_sw_36384381.wav	halmashauri ya walinzi wa katiba wanaokubali au kukataa 
/scratch/skscla001/speech/data/swagen/audio/common_voice_sw_30470966.wav	kupunguza idadi ya washambuliaji na kuongeza beki au viungo wakabaji 
/scratch/skscla001/speech/data/swagen/audio/common_voice_sw_29795940.wav	tangu kuundwa kwake hadi kuzama kwake ilikuwa na umri wa miaka kumi na saba 
/scratch/skscla001/speech/data/swagen/audio/common_voice_sw_28683246.wav	chanzo cha mto ruvuma kipo karibu na mji 
/scratch/skscla001/speech/data/swagen/audio/common_voice_sw_30313768.wav	jambo linaloshangaza wengi ni kwamba ndiyo staili hiyohiyo iliyotumika kuua waganda wengine 
/scratch/skscla001/speech/data/swagen/audio/common_voice_sw_30634564.wav	elfu tano mai moja arobaini na tisa 
/scratch/skscla001/speech/data/swagen/audio/common_voice_sw_28981428.wav	baadaye huyu mwana wa kwanza alikuwa chifu wa bumbuli kwa kibali cha baba 
/scratch/skscla001/speech/data/swagen/audio/common_voice_sw_30342746.wav	wapare pia wanaishi katika wilaya ya lushoto mkoani tanga sehemu za bumbuli na mavumo 
/scratch/skscla001/speech/data/swagen/audio/common_voice_sw_37230132.wav	ziliieleza kwamba fidel castro amefariki dunia usiku wa tarehe 
/scratch/skscla001/speech/data/swagen/audio/common_voice_sw_30021359.wav	ziwa viktoria linapatikanankaskazini magharibi mwa tanzania 
/scratch/skscla001/speech/data/swagen/audio/common_voice_sw_36387560.wav	na ndiyo kwa maana kwamba kwanza imani 
/scratch/skscla001/speech/data/swagen/audio/common_voice_sw_36014041.wav	kuwa na mazungumzo ya makubaliano ya kiserikali ili 
/scratch/skscla001/speech/data/swagen/audio/common_voice_sw_29942774.wav	wamasai hawaamini kama dunia inaweza ikaishiwa na simba 
/scratch/skscla001/speech/data/swagen/audio/common_voice_sw_28581479.wav	aina ya tano hupatikana katika sehemu ya bara hindi na arabia 
/scratch/skscla001/speech/data/swagen/audio/common_voice_sw_30342849.wav	ghana waliibuka washindi wa kombe kwenye fainali zilizochezwa nchini kwao 
/scratch/skscla001/speech/data/swagen/audio/common_voice_sw_30180841.wav	abedi ayew pele alikuwa mchezaji bora wa afrika 
/scratch/skscla001/speech/data/swagen/audio/common_voice_sw_28259873.wav	hakuna tofauti kubwa sana 
/scratch/skscla001/speech/data/swagen/audio/common_voice_sw_36037083.wav	watu hao waliambukizwa virusi vya ukimwi 
/scratch/skscla001/speech/data/swagen/audio/common_voice_sw_36013838.wav	akaniambia ni pige zain kwenye website ya tume 
/scratch/skscla001/speech/data/swagen/audio/common_voice_sw_36380995.wav	huku wanajeshi wengine wakiachishwa kazi na wengine wakishtakiwa 
/scratch/skscla001/speech/data/swagen/audio/common_voice_sw_30025176.wav	waakie na waakiek pamoja na waalegwa na waarusha 
/scratch/skscla001/speech/data/swagen/audio/common_voice_sw_30382033.wav	mwendo wa twiga ni wa maringo lakini akiwa anafukuzwa hukimbia sana mpaka kufikia mwendokasi 
/scratch/skscla001/speech/data/swagen/audio/common_voice_sw_30335416.wav	meno ya plastiki pia imani hiyo si ya pekee kwa wamasai 
/scratch/skscla001/speech/data/swagen/audio/common_voice_sw_30380535.wav	jeshi la askari elfu nane kutoka katika taifa la india 
/scratch/skscla001/speech/data/swagen/audio/common_voice_sw_30342947.wav	mafanikio ya utawala wake yalikuwa makubwa sana 
/scratch/skscla001/speech/data/swagen/audio/common_voice_sw_29942703.wav	na kizazi hivyo utofauti wake unatokana na wakati na watu waliyosimulia historia hizo 
/scratch/skscla001/speech/data/swagen/audio/common_voice_sw_28662043.wav	dalili zinaweza kujumuisha maumivu na ugumu wa kula chakula 
/scratch/skscla001/speech/data/swagen/audio/common_voice_sw_30629356.wav	zanzibar ni sehemu inayounda eneo la jamhuri 
/scratch/skscla001/speech/data/swagen/audio/common_voice_sw_29696731.wav	eneo hili ni kubwa kushinda eneo la rwanda au burundi 
/scratch/skscla001/speech/data/swagen/audio/common_voice_sw_28681721.wav	pua hii hutumika kwa kukamata na kukata mawindo 
/scratch/skscla001/speech/data/swagen/audio/common_voice_sw_29936699.wav	wanaoishi mkoa wa mbeya wanyakyusa wanapakana na watu wa malawi wanaoishi 
/scratch/skscla001/speech/data/swagen/audio/common_voice_sw_29954200.wav	maendeleo ya kuimarisha uchumi bado yanaendelea mpaka sasa katika nchi 
/scratch/skscla001/speech/data/swagen/audio/common_voice_sw_30575025.wav	mimea kadhaa huota miti mingi hudondosha majani yake 
/scratch/skscla001/speech/data/swagen/audio/common_voice_sw_30586118.wav	wapare wanatokea katika wilaya za same na mwanga mkoani wa kilimanjaro 
/scratch/skscla001/speech/data/swagen/audio/common_voice_sw_36350479.wav	alinijibu kuwa kitongoji hiki kimepewa jina hilo kwa heshima ya mpiganaji huyo kinjekitile ngwale 
/scratch/skscla001/speech/data/swagen/audio/common_voice_sw_28682407.wav	miguu ina rangi ya machungwa 
/scratch/skscla001/speech/data/swagen/audio/common_voice_sw_28682623.wav	ina nishati nyingi ndani yake inayotumiwa kwa njia ya mitambo 
/scratch/skscla001/speech/data/swagen/audio/common_voice_sw_29795557.wav	hapa ni mahali ambapo wazee wetu walipatumia kama darubini 
/scratch/skscla001/speech/data/swagen/audio/common_voice_sw_30100346.wav	kukomeshwa kwa utawala wa kibaguzi afrika kusini 
/scratch/skscla001/speech/data/swagen/audio/common_voice_sw_29796077.wav	pori la kimisi likiwa na ukubwa wa kilomita za mraba elfu moja na thelathini 
/scratch/skscla001/speech/data/swagen/audio/common_voice_sw_28681301.wav	kwanza alikuwa mke wa gavana 
/scratch/skscla001/speech/data/swagen/audio/common_voice_sw_31386319.wav	zinapatikana hadi ziwa chala na taveta upande wa kusini mashariki 
/scratch/skscla001/speech/data/swagen/audio/common_voice_sw_30025736.wav	ameweza kuwafundisha watu wengi ambao hawana ulemavu na wenye ulemavu 
/scratch/skscla001/speech/data/swagen/audio/common_voice_sw_36310986.wav	mgonjwa wa ini atapata kichefuchefu na kutapika 
/scratch/skscla001/speech/data/swagen/audio/common_voice_sw_28993473.wav	pamoja na hayo mwenyewe aliendelea kutunga vitabu mbalimbali 
/scratch/skscla001/speech/data/swagen/audio/common_voice_sw_35132360.wav	victor robert willi amezungumza na shaq mumbere ambae 
/scratch/skscla001/speech/data/swagen/audio/common_voice_sw_28745259.wav	kulipa mahari unapatikana hata ulaya 
/scratch/skscla001/speech/data/swagen/audio/common_voice_sw_29630386.wav	tofauti muhimu ni tabia no 
/scratch/skscla001/speech/data/swagen/audio/common_voice_sw_30205096.wav	ukitakata kujua ukali wa mbrazil huyu 
/scratch/skscla001/speech/data/swagen/audio/common_voice_sw_36013920.wav	alikuwa anaishi nchini kameruni kwa wakati huo 
/scratch/skscla001/speech/data/swagen/audio/common_voice_sw_30661120.wav	mfano maeneo ya nchi za jamhuri ya kidemokrasia ya congo 
/scratch/skscla001/speech/data/swagen/audio/common_voice_sw_30326755.wav	ivory coast waliibuka washindi kwa kuichapa ghana mabao tisa kwa manane 
/scratch/skscla001/speech/data/swagen/audio/common_voice_sw_28682656.wav	maisha ya mtu hayana thamani nchini humo 
/scratch/skscla001/speech/data/swagen/audio/common_voice_sw_29796767.wav	mkoani kilimanjaro kuna kabila la wachaga 
/scratch/skscla001/speech/data/swagen/audio/common_voice_sw_36386104.wav	ni tisho jipwa kwa mji mkuu nchini haiti kwani tayari 
/scratch/skscla001/speech/data/swagen/audio/common_voice_sw_31306219.wav	rhodesia ilikuwa na uhusiano wa kijeshi na utawala wa idi amin 
/scratch/skscla001/speech/data/swagen/audio/common_voice_sw_30180978.wav	mataifa yanavutiwa na maonyesho ya blob yanayofanyika kila mwaka 
/scratch/skscla001/speech/data/swagen/audio/common_voice_sw_36945650.wav	tunaweza kuya kuya kuyazuia kabla hayajatokea 
/scratch/skscla001/speech/data/swagen/audio/common_voice_sw_36381345.wav	wote kutoka kanisa la kikopti la misri labda tumeshangaa kusikia ya 
/scratch/skscla001/speech/data/swagen/audio/common_voice_sw_36381337.wav	kwamba hizi habari zitabaki siri maanake ni miundo na mikakati ya uhifadhi 
/scratch/skscla001/speech/data/swagen/audio/common_voice_sw_28663293.wav	hali ya hewa ni ya kitropiki ikiwa na tofauti kutokana na kimo 
/scratch/skscla001/speech/data/swagen/audio/common_voice_sw_29507950.wav	wakati huo makao yao makuu yalikuwa mjini elmhurst katika eneo la illinois 
/scratch/skscla001/speech/data/swagen/audio/common_voice_sw_29896938.wav	hushughulika pia ukubwa na usambazaji wa faida kutoka kwenye biashara 
/scratch/skscla001/speech/data/swagen/audio/common_voice_sw_37229655.wav	mali ya wachina mwenyewe alisema anajipa raha jifurahishe ungali hai chameleone alijigamba 
/scratch/skscla001/speech/data/swagen/audio/common_voice_sw_29805176.wav	kuna makadirio ya kwamba jumla ya watu laki moja hadi laki tano waliuawa 
/scratch/skscla001/speech/data/swagen/audio/common_voice_sw_29685802.wav	kuna pia kiwanda cha maziwa 
/scratch/skscla001/speech/data/swagen/audio/common_voice_sw_29960946.wav	kuna mabaki ya uoto wa savana ya awali yenye miti kama acacia na combretum 
/scratch/skscla001/speech/data/swagen/audio/common_voice_sw_29936391.wav	rais yoweri museveni wa uganda alitangaza mikakati kumi na moja 
/scratch/skscla001/speech/data/swagen/audio/common_voice_sw_29995089.wav	na latitudo tano kumi na sita kusini mwa ikweta 
/scratch/skscla001/speech/data/swagen/audio/common_voice_sw_29434588.wav	kwa sababu hiyo walianzisha mkutano wao wa haki za wanawake 
/scratch/skscla001/speech/data/swagen/audio/common_voice_sw_30342844.wav	ni jambo la kushangaza kuona kuwa mpango huu haukuanzishwa afrika 
/scratch/skscla001/speech/data/swagen/audio/common_voice_sw_34751043.wav	katika vitabu vyake na uinjilishaji uliendelea katika ulaya ya kati 
/scratch/skscla001/speech/data/swagen/audio/common_voice_sw_36616926.wav	alijaza maji kwenye chupa 
/scratch/skscla001/speech/data/swagen/audio/common_voice_sw_30437163.wav	vifaru weusi wanaonekana waliletwa mkomazi kutoka afrika kusini 
/scratch/skscla001/speech/data/swagen/audio/common_voice_sw_29660533.wav	katika nchi nyingi tendo la kubadilishana pesa bidhaa nakadhalika 
/scratch/skscla001/speech/data/swagen/audio/common_voice_sw_32295897.wav	kitoria lifenenee na ichungwa 
/scratch/skscla001/speech/data/swagen/audio/common_voice_sw_29943400.wav	maharage ni mazuri kwasababu yana faida nyingi mwilini ikiwemo kushusha shinikizo la damu 
/scratch/skscla001/speech/data/swagen/audio/common_voice_sw_30223656.wav	katika nchi ya kigeni utaburudika sana na kuelimika 
/scratch/skscla001/speech/data/swagen/audio/common_voice_sw_29697203.wav	sababu ya kifo chake ilikuwa kansa 
/scratch/skscla001/speech/data/swagen/audio/common_voice_sw_29624515.wav	katika nchi nyingi huwa na kawaida ya kutembelea pia makaburi ya marehemu 
/scratch/skscla001/speech/data/swagen/audio/common_voice_sw_30268832.wav	waandishi wa kitabu cha deadly developments stephen na downs reyna 
/scratch/skscla001/speech/data/swagen/audio/common_voice_sw_36385574.wav	yeye anapenda raha sana 
/scratch/skscla001/speech/data/swagen/audio/common_voice_sw_30091430.wav	pep guardiola alitaka kukutana na mzee bielsa 
/scratch/skscla001/speech/data/swagen/audio/common_voice_sw_37089618.wav	nne thelathini na watatu wakiwemo wahudumu 
/scratch/skscla001/speech/data/swagen/audio/common_voice_sw_30021117.wav	mjadala wa nani bora kati ya pele na maradona ufungwe kwa wote kupewa heshima 
/scratch/skscla001/speech/data/swagen/audio/common_voice_sw_34392065.wav	walimshtaki kwamba anamsaidia kaka yake kisiri 
/scratch/skscla001/speech/data/swagen/audio/common_voice_sw_29906511.wav	bila kutegemea msaada wowote kutoka nchi za kigeni kwa muda huo 
/scratch/skscla001/speech/data/swagen/audio/common_voice_sw_29795456.wav	awali januari thelasini na moja mwaka elfu mbili na tano ilikuwa ya baraka 
/scratch/skscla001/speech/data/swagen/audio/common_voice_sw_30180604.wav	mbu hawa wasambazaji huanza kuuma giza linapoingia hadi kunapopambazuka 
/scratch/skscla001/speech/data/swagen/audio/common_voice_sw_30341915.wav	hili ni swali ambalo mamlaka za ulinzi na usalama za uganda zinapaswa kulijibu 
/scratch/skscla001/speech/data/swagen/audio/common_voice_sw_28695267.wav	wote wawili wanaishi mjini paris ufaransa 
/scratch/skscla001/speech/data/swagen/audio/common_voice_sw_28582433.wav	mipaka mingine ni ya ghuba ya uajemi 
/scratch/skscla001/speech/data/swagen/audio/common_voice_sw_29945047.wav	mpandaji wa mlima huu anapitia kanda tofati za hewa 
/scratch/skscla001/speech/data/swagen/audio/common_voice_sw_29937828.wav	samahani sana mkuu nimeingia bila kugonga hodi 
/scratch/skscla001/speech/data/swagen/audio/common_voice_sw_35683601.wav	wakti huo ambapo majeshi kutoka nchi za kujihami 
/scratch/skscla001/speech/data/swagen/audio/common_voice_sw_30209722.wav	kampuni hii ilihitaji kituo kwa ajili ya jahazi 
/scratch/skscla001/speech/data/swagen/audio/common_voice_sw_30671504.wav	bahati yake huwa mbaya anapowindwa na wanyama walao nyama kama simba 
/scratch/skscla001/speech/data/swagen/audio/common_voice_sw_37084733.wav	uwezekano kwamba spishi nyingi zisizojulikana katika amazon 
/scratch/skscla001/speech/data/swagen/audio/common_voice_sw_30181175.wav	halmashauri ya wilaya ya songwe na halmashauri ya wilaya ya ileje 
/scratch/skscla001/speech/data/swagen/audio/common_voice_sw_30233665.wav	anaipongeza mchezo pesa kwa kutimiza makubaliano yaliyokuwepo 
/scratch/skscla001/speech/data/swagen/audio/common_voice_sw_29941719.wav	anacheza mipira mingi ya juu na nguvu na akili 
/scratch/skscla001/speech/data/swagen/audio/common_voice_sw_29988534.wav	kabla ya mwalimu nyerere hajaongea na watanganyika 
/scratch/skscla001/speech/data/swagen/audio/common_voice_sw_30342838.wav	inayokamilisha jumla ya halmashauri tano za mkoa wa songwe 
/scratch/skscla001/speech/data/swagen/audio/common_voice_sw_36331661.wav	na kwamba wako pale kwa maslahi yao binafsi 
/scratch/skscla001/speech/data/swagen/audio/common_voice_sw_30323504.wav	mfano mapango ya amboni pangani na sehemu nyingine nyingi 
/scratch/skscla001/speech/data/swagen/audio/common_voice_sw_30582985.wav	mabasi ya mwendokazi ni nyenzo muhimu ya pato la taifa 
/scratch/skscla001/speech/data/swagen/audio/common_voice_sw_29943285.wav	mmoja amebobea kwenye falsafa ya uchumi 
/scratch/skscla001/speech/data/swagen/audio/common_voice_sw_30095220.wav	wanalaumu pia dhuluma dhidi ya wabatisti ambazo martin luther alizitetea 
/scratch/skscla001/speech/data/swagen/audio/common_voice_sw_36387521.wav	tulikuwa na mazigaziga 
/scratch/skscla001/speech/data/swagen/audio/common_voice_sw_29309168.wav	uchumi wa kisasa ulianzishwa kwa mashamba ya miwa na uvuvi 
/scratch/skscla001/speech/data/swagen/audio/common_voice_sw_30026482.wav	wamekuwa wakijipatia kipato kikubwa sana kupitia kilimo cha mbogmboga za aina mbalimbali 
/scratch/skscla001/speech/data/swagen/audio/common_voice_sw_30647726.wav	tembo na nyumbu walikuwa na ushawishi mkubwa katika kuamua sasa muundo wa serengeti 
/scratch/skscla001/speech/data/swagen/audio/common_voice_sw_28670201.wav	yapo matoleo mawili ya muziki wa video 
/scratch/skscla001/speech/data/swagen/audio/common_voice_sw_30334820.wav	mji wa bagamoyo ulihusishwa na biashara ya masafa marefu 
/scratch/skscla001/speech/data/swagen/audio/common_voice_sw_30382839.wav	katika mto malagarasi na katika mto rwiche na mkoza 
/scratch/skscla001/speech/data/swagen/audio/common_voice_sw_30200964.wav	sehemu kubwa ya mkoa ni yenye milima 
/scratch/skscla001/speech/data/swagen/audio/common_voice_sw_28682745.wav	kama mwendo wa upepo ni mdogo hata uzalishaji ni duni 
/scratch/skscla001/speech/data/swagen/audio/common_voice_sw_30202106.wav	wilaya inashirikiana na wadau mbalimbali waliopo wilayani katika kuendeleza sekta ya kilimo 
/scratch/skscla001/speech/data/swagen/audio/common_voice_sw_36311098.wav	kwa mpandaji ambae atapenda kuupanda mlima meru 
/scratch/skscla001/speech/data/swagen/audio/common_voice_sw_37090357.wav	wakati wa ufunguzi wa mkutano huo wa bunge la afghanistan 
/scratch/skscla001/speech/data/swagen/audio/common_voice_sw_30434370.wav	nyerere alimuagiza sheikh yahya atafsiri maana ya ile namba mia moja kumi na tano 
/scratch/skscla001/speech/data/swagen/audio/common_voice_sw_29419992.wav	kuna kisiwa kikubwa cha madagaska na funguvisiwa mbalimbali 
/scratch/skscla001/speech/data/swagen/audio/common_voice_sw_28581560.wav	hewa yenyewe ni gimba la gesi 
/scratch/skscla001/speech/data/swagen/audio/common_voice_sw_29796690.wav	mfugale ni mchapakazi mzalendo mbunifu na mwaminifu katika kazi zake 
/scratch/skscla001/speech/data/swagen/audio/common_voice_sw_29995494.wav	wengi wanafahamu kuwa akina mama wajawazito wanapaswa 
/scratch/skscla001/speech/data/swagen/audio/common_voice_sw_30026561.wav	kisiwa cha mafia hakijawahi kuchukuliwa kuwa sehemu ya zanzibar 
/scratch/skscla001/speech/data/swagen/audio/common_voice_sw_28825451.wav	kuna mbinu mbalimbali kupanga historia hii na kutambua ngazi za maendeleo ndani yake 
/scratch/skscla001/speech/data/swagen/audio/common_voice_sw_29936414.wav	nyerere alikuwa hapendi ushauri wa mtu yeyote 
/scratch/skscla001/speech/data/swagen/audio/common_voice_sw_29795404.wav	karafuu na mahindi bila kusasahu samaki na vitu vingine 
/scratch/skscla001/speech/data/swagen/audio/common_voice_sw_29427423.wav	watu vitu na mahali wanaweza kuwekwa wakfu kwa namna mbalimbali 
/scratch/skscla001/speech/data/swagen/audio/common_voice_sw_29936859.wav	anasema chini ya majengo mengi kuna njia za mahandaki zilizotengenezwa kwa ajili ya ulinzi 
/scratch/skscla001/speech/data/swagen/audio/common_voice_sw_29943844.wav	mbuni wote wanasaidiana kuwatunza watoto wao 
/scratch/skscla001/speech/data/swagen/audio/common_voice_sw_29878166.wav	katika wilaya ya mwanga kuna idadi kubwa ya waluteri na waislamu 
/scratch/skscla001/speech/data/swagen/audio/common_voice_sw_29994798.wav	kingine huweka akiba tumboni mwake hivyo muda anapopumzika hucheua na kuanza kula upya 
/scratch/skscla001/speech/data/swagen/audio/common_voice_sw_31304595.wav	wananchi wa manispaa ya mtwara mikindani wanajishughulisha na biashara 
