audio	sentence
/scratch/skscla001/speech/data/swagen/audio/common_voice_sw_28681605.wav	mashindano hayo hufanywa kati ya nchi tofauti bara na hata ya dunia nzima 
/scratch/skscla001/speech/data/swagen/audio/common_voice_sw_29961765.wav	kwenye msitu wa amani utaweza kuona nyani weupe na bluu 
/scratch/skscla001/speech/data/swagen/audio/common_voice_sw_28581706.wav	alipelekwa uhamishoni na kaisari leo v kwa sababu ya kutetea matumizi ya picha takatifu 
/scratch/skscla001/speech/data/swagen/audio/common_voice_sw_29795272.wav	hiyo ilikuwa ndiyo nyenzo kubwa katika maendeleo ya taifa letu 
/scratch/skscla001/speech/data/swagen/audio/common_voice_sw_29898637.wav	katika serikali mpya uliogopesha nchi za magharibi 
/scratch/skscla001/speech/data/swagen/audio/common_voice_sw_38106566.wav	kisha bekteria hao huingia kwenye mfumo wa kusaga au kumengenya chakula 
/scratch/skscla001/speech/data/swagen/audio/common_voice_sw_28681046.wav	shabaha ya shirika hili ni usaidizi kwa wakimbizi duniani 
/scratch/skscla001/speech/data/swagen/audio/common_voice_sw_28582430.wav	na nyumba ilikuwa na wahudumu wengi kupita kiasi 
/scratch/skscla001/speech/data/swagen/audio/common_voice_sw_30148699.wav	iliyojulikana kwa jina la boshazi maana yake bondei zigua sambaa 
/scratch/skscla001/speech/data/swagen/audio/common_voice_sw_29895682.wav	sehemu hiyo inadumisha utalii wa kihistoria ndani ya tanzania 
/scratch/skscla001/speech/data/swagen/audio/common_voice_sw_28684932.wav	hata leo anaheshimiwa na kanisa katoliki na waorthodoksi kama mtakatifu 
/scratch/skscla001/speech/data/swagen/audio/common_voice_sw_30021740.wav	milton obote alikuwa mtu wa kabila la walango kutoka kaskazini mwa uganda 
/scratch/skscla001/speech/data/swagen/audio/common_voice_sw_30181403.wav	hali ya hewa na vivutio vya kitalii viliwavutia walowezi na wakoloni wakaweka makazi yao 
/scratch/skscla001/speech/data/swagen/audio/common_voice_sw_30098931.wav	bagamoyo iko kati ya miji ya kale kabisa 
/scratch/skscla001/speech/data/swagen/audio/common_voice_sw_36385673.wav	alitumikia taifa hadi mwaka wa elfumbili na tano alipochaguliwa tena 
/scratch/skscla001/speech/data/swagen/audio/common_voice_sw_30574676.wav	wakati huo akizichezea timu mbalimbali za ligi hiyo ikiwemo real madrid na valencia 
/scratch/skscla001/speech/data/swagen/audio/common_voice_sw_30323458.wav	hata hivyo serikali ikaendelea kulipa zaidi ya dolar za marekani laki moja kila siku 
/scratch/skscla001/speech/data/swagen/audio/common_voice_sw_28660854.wav	haki hiyo inahusu mtu binafsi na makundi pia 
/scratch/skscla001/speech/data/swagen/audio/common_voice_sw_30019810.wav	neno lenyewe linaonekana kuwa na nguvu isiyo ya kawaida 
/scratch/skscla001/speech/data/swagen/audio/common_voice_sw_29518817.wav	manyoya ya watoto huwa marefu na mengi kuliko ya wakubwa 
/scratch/skscla001/speech/data/swagen/audio/common_voice_sw_36387935.wav	ally salum hapi alikuwa akisoma sheria 
/scratch/skscla001/speech/data/swagen/audio/common_voice_sw_35132563.wav	naam nitakuwa huko victor nafikiri nikiripoti kutoka huko huko sudani 
/scratch/skscla001/speech/data/swagen/audio/common_voice_sw_36255575.wav	kwamba sasa walau hata kuna mjadala kuhusu chato inafaa au haifai kuwa mkoa 
/scratch/skscla001/speech/data/swagen/audio/common_voice_sw_30121662.wav	ukosefu wa viwanja vya ndege karibu na hifadhi 
/scratch/skscla001/speech/data/swagen/audio/common_voice_sw_34392841.wav	hunisafi na dhambi hunifanya mshindi 
/scratch/skscla001/speech/data/swagen/audio/common_voice_sw_34764209.wav	vibaya ikiwa ni pamoja na kuvunjika miguu yote walinzi wa hoteli hiyo walikimbilia eneo 
/scratch/skscla001/speech/data/swagen/audio/common_voice_sw_29994310.wav	watu wote wanaoishi na maambukizi ya virusi vya ukimwi 
/scratch/skscla001/speech/data/swagen/audio/common_voice_sw_28681130.wav	anaendelea kuhamasisha na kufundisha wasanii nchini afrika kusini 
/scratch/skscla001/speech/data/swagen/audio/common_voice_sw_30182662.wav	mama yake alikuwa anafanya biashara katika soko moja 
/scratch/skscla001/speech/data/swagen/audio/common_voice_sw_36390658.wav	kule maisha ya kufunga na kusali watawa hao waliitwa kwa jina la kigiriki 
/scratch/skscla001/speech/data/swagen/audio/common_voice_sw_34746480.wav	la misheni hizo lilikuwa kwamba liliambatana na uenezaji wa kijeshi wa 
/scratch/skscla001/speech/data/swagen/audio/common_voice_sw_36104411.wav	ambayo yamepangwa utekelezaji wake kukamilika ifikapo mwaka elfu mbili na thelathini 
/scratch/skscla001/speech/data/swagen/audio/common_voice_sw_37096981.wav	ambao kwa miaka kumi iliyopita alilazimika kuukumbatia 
/scratch/skscla001/speech/data/swagen/audio/common_voice_sw_30574424.wav	kabla ya kutokea ukame mkubwa sana uliosababisha njaa katika eneo hilo 
/scratch/skscla001/speech/data/swagen/audio/common_voice_sw_29962142.wav	mbio za mbuni zinamsaidia kuokoa maisha yake 
/scratch/skscla001/speech/data/swagen/audio/common_voice_sw_31286345.wav	raia wa uingereza na mwenyekiti wa kampuni ya ndege aliyeitwa bwana herri william 
/scratch/skscla001/speech/data/swagen/audio/common_voice_sw_29993109.wav	chakula chao ni ugali wa mahindi ulezi na mtama kidogo 
/scratch/skscla001/speech/data/swagen/audio/common_voice_sw_34750298.wav	ruvuma ruaha mkuu au mto tana ambayo yote inaishia katika bahari hindi 
/scratch/skscla001/speech/data/swagen/audio/common_voice_sw_29968292.wav	jina la serengeti limetokana na neno la kimasai linaloitwa serengiti 
/scratch/skscla001/speech/data/swagen/audio/common_voice_sw_30380400.wav	siku hzi baadhi yao wamejiingiza kwenye wizi 
/scratch/skscla001/speech/data/swagen/audio/common_voice_sw_29958418.wav	ni julius kambarage nyerere na robert gabriel mugabe 
/scratch/skscla001/speech/data/swagen/audio/common_voice_sw_28695758.wav	hujenga tago lao juu ya mti msituni 
/scratch/skscla001/speech/data/swagen/audio/common_voice_sw_30635690.wav	uchaguzi wa kwanza wa vyama vingi unafanyika 
/scratch/skscla001/speech/data/swagen/audio/common_voice_sw_30647734.wav	idi amin ni mtoto wa andreas nyabire 
/scratch/skscla001/speech/data/swagen/audio/common_voice_sw_36383708.wav	twiga hutumia muda mfupi sana kulala ukilinganisha na muda anaotumia kwenye kula 
/scratch/skscla001/speech/data/swagen/audio/common_voice_sw_30182598.wav	mto nile unatiririsha maji katika bahari iliyopo kaskazini mashariki mwa afrika 
/scratch/skscla001/speech/data/swagen/audio/common_voice_sw_37093105.wav	mfumo wa utayarishaji wa mipango kwa kuzingatia fursa na vikwazo 
/scratch/skscla001/speech/data/swagen/audio/common_voice_sw_29963715.wav	nyumbu akikamatwa tu basi hutulia na kuliwa bila shida 
/scratch/skscla001/speech/data/swagen/audio/common_voice_sw_35683505.wav	karibu mara nyingi husikia maneno uturuki kubwa 
/scratch/skscla001/speech/data/swagen/audio/common_voice_sw_30327063.wav	kupiti ziwa nyasa mkoani ruvuma kusini mwa nchi 
/scratch/skscla001/speech/data/swagen/audio/common_voice_sw_29884634.wav	wote hao wawili walikuwa askari waliofanya mapinduzi kuingia madarakani 
/scratch/skscla001/speech/data/swagen/audio/common_voice_sw_31475973.wav	nadhari hii hutoa mfumo rasmi wa mwelekeo kwa hali za kijamii 
/scratch/skscla001/speech/data/swagen/audio/common_voice_sw_34765139.wav	khimji nae aliuza msitu huu kwa asar 
/scratch/skscla001/speech/data/swagen/audio/common_voice_sw_31304407.wav	lakini kwa wanyaturu mama ndiye alikuwa akinyooshewa kidole 
/scratch/skscla001/speech/data/swagen/audio/common_voice_sw_30470916.wav	nchi mbalimbali zilijitenga na kupata uhuru kama vile ugiriki 
/scratch/skscla001/speech/data/swagen/audio/common_voice_sw_28663325.wav	kweli alijitahidi kuleta hali mpya katika kanisa 
/scratch/skscla001/speech/data/swagen/audio/common_voice_sw_29856726.wav	forodhani ni mashuhuri kwa upishi na uuzaji wa vyakupa vya bahari 
/scratch/skscla001/speech/data/swagen/audio/common_voice_sw_29895961.wav	tangu mwaka elfu moja mia nane themanini na tano 
/scratch/skscla001/speech/data/swagen/audio/common_voice_sw_29182621.wav	mwaka uliofuata aliigiza kama mwanafunzi djamila kwenye reviravolta 
/scratch/skscla001/speech/data/swagen/audio/common_voice_sw_36350664.wav	mbwa anaweza kukuuma 
/scratch/skscla001/speech/data/swagen/audio/common_voice_sw_31326716.wav	utafiti wa biashara michezo na uandishi wa habari za kisiasa 
/scratch/skscla001/speech/data/swagen/audio/common_voice_sw_28689991.wav	elimu ya msingi ni ya lazima nchini bangladesh 
/scratch/skscla001/speech/data/swagen/audio/common_voice_sw_31797427.wav	wakoloni walikuwa na nia zaidi kenye ardhi nzuri ya wamasai 
/scratch/skscla001/speech/data/swagen/audio/common_voice_sw_30179981.wav	tangu vita kati ya ufaransa na ujerumani mika mingi iliyopita 
/scratch/skscla001/speech/data/swagen/audio/common_voice_sw_28260625.wav	ana mapenzi mazito na mkewe 
/scratch/skscla001/speech/data/swagen/audio/common_voice_sw_30434798.wav	akianza matibabu mapema anaweza kuzuia ini lake lisiharibike sana 
/scratch/skscla001/speech/data/swagen/audio/common_voice_sw_31304425.wav	kila mwanamke alimzungumzia kwa namna yake 
/scratch/skscla001/speech/data/swagen/audio/common_voice_sw_28725264.wav	pande zote mbili zilikuwa chanya kuhusu matokeo ya mikutano 
/scratch/skscla001/speech/data/swagen/audio/common_voice_sw_36067293.wav	rais wa jamhuri amekutana na kuzungumza na mkurugenzi mkuu wa benki ya kiarabu 
/scratch/skscla001/speech/data/swagen/audio/common_voice_sw_29938476.wav	wilaya hii ilianzishwa mwaka elfu moja mia tisa sabini na tisa 
/scratch/skscla001/speech/data/swagen/audio/common_voice_sw_30025168.wav	jim thompson aliandika mnamo mwaka elfu moja mia nane themanini na tano 
/scratch/skscla001/speech/data/swagen/audio/common_voice_sw_31370571.wav	idadi ya wazanzibari ilikuwa asilimia tatu tu ya watanganyika 
/scratch/skscla001/speech/data/swagen/audio/common_voice_sw_30574934.wav	mourinho ameingia kandarasi na klabu ya roma 
/scratch/skscla001/speech/data/swagen/audio/common_voice_sw_36381716.wav	takriban mia saba elfu wanaokaa upande wa tanzania 
/scratch/skscla001/speech/data/swagen/audio/common_voice_sw_29898553.wav	ufundi na usanifu majengo katika mji huu mkongwe ulitokana na pande hizo nne zilizo 
/scratch/skscla001/speech/data/swagen/audio/common_voice_sw_30021420.wav	ya kutembelea hifadhi kubwa kama tatu nakupewa 
/scratch/skscla001/speech/data/swagen/audio/common_voice_sw_30321951.wav	sifa kubwa ya wazigua ni kuchukia uovu 
/scratch/skscla001/speech/data/swagen/audio/common_voice_sw_29618143.wav	miguu ni mirefu na kichwa kikubwa chenye shingo nyembamba 
/scratch/skscla001/speech/data/swagen/audio/common_voice_sw_36308872.wav	mbinu yake ilimsaidia kuokoa maisha yake 
/scratch/skscla001/speech/data/swagen/audio/common_voice_sw_30363994.wav	kuchangia vifaa vyenye ncha kali kama sindano hasa kwa watumia madawa ya kulevya 
/scratch/skscla001/speech/data/swagen/audio/common_voice_sw_37088454.wav	ligi kuu ya italia akiwa na juventus na kombe la mabara 
/scratch/skscla001/speech/data/swagen/audio/common_voice_sw_30575352.wav	utalii umechangia asilimia kumi ya jumla ya pato la nchi zote ulimwenguni 
/scratch/skscla001/speech/data/swagen/audio/common_voice_sw_36386307.wav	za mohammed zilikuwa za asili ya kitheokrasi na zilikuwa na kanuni 
/scratch/skscla001/speech/data/swagen/audio/common_voice_sw_29936696.wav	hatimae watawala wa omani waliingilia kati na kuwafukuza mabaki ya wareno 
/scratch/skscla001/speech/data/swagen/audio/common_voice_sw_30470830.wav	pia kuogopa mlipuko wa magonjwa kwa raia wao 
/scratch/skscla001/speech/data/swagen/audio/common_voice_sw_30384776.wav	lilikuwa jaribio la mapinduzi lililoshindwa kwa serikali ya mapinduzi 
/scratch/skscla001/speech/data/swagen/audio/common_voice_sw_30210006.wav	ushanga huwa sehemu muhimu ya urembesho wa miili yao 
/scratch/skscla001/speech/data/swagen/audio/common_voice_sw_30574789.wav	makabila mengine yanayomwamini mungu wa mbinguni 
/scratch/skscla001/speech/data/swagen/audio/common_voice_sw_36331449.wav	watu wanarudia matokeo ya vipimo kila maada ya miezi mitatu 
/scratch/skscla001/speech/data/swagen/audio/common_voice_sw_29450299.wav	tunda lina ngozi gumu kiasi yenye rangi ya kijani 
/scratch/skscla001/speech/data/swagen/audio/common_voice_sw_31858725.wav	wote wadhima 
/scratch/skscla001/speech/data/swagen/audio/common_voice_sw_30020692.wav	jakaya mrisho kikwete alikamilisha kipindi cha utawala wake 
/scratch/skscla001/speech/data/swagen/audio/common_voice_sw_29837308.wav	zipo pia mbuga za kakuma na turkana pamoja na naivasaha 
/scratch/skscla001/speech/data/swagen/audio/common_voice_sw_29850290.wav	waandishi wa habari nchini tanzania wanasema wamekuwa wakipitia kwenye wakati mgumu 
/scratch/skscla001/speech/data/swagen/audio/common_voice_sw_30122051.wav	epuka kuosha nywele kwa maji ya moto 
/scratch/skscla001/speech/data/swagen/audio/common_voice_sw_30380372.wav	wasukuma wengi pia wanapatikana katika mikoa ya rukwa katavi na morogoro 
/scratch/skscla001/speech/data/swagen/audio/common_voice_sw_30323818.wav	yakianguka kupitia msituni na kutua mithili ya mianzo ya ukungu bondeni 
/scratch/skscla001/speech/data/swagen/audio/common_voice_sw_37222853.wav	ya anatolia ambayo wengi wa uturuki wa sasa 
/scratch/skscla001/speech/data/swagen/audio/common_voice_sw_37229877.wav	muundo wa serengeti unawavutia watalii wengi sana 
/scratch/skscla001/speech/data/swagen/audio/common_voice_sw_35224115.wav	ni ziara iliyokuwa na mafanikio makubwa kwa 
/scratch/skscla001/speech/data/swagen/audio/common_voice_sw_30641382.wav	lango la marangu ndiyo makao makuu ya hifadhi 
/scratch/skscla001/speech/data/swagen/audio/common_voice_sw_37089359.wav	kaa nami yesu 
/scratch/skscla001/speech/data/swagen/audio/common_voice_sw_30327348.wav	kuchanganya damu ya ngombe na maziwa inafanywa kuandaa kinywaji 
/scratch/skscla001/speech/data/swagen/audio/common_voice_sw_36374751.wav	chameleon jose amesema kuwa anataka kuwa meya wa mji mkuu wa uganda kampala nyota 
/scratch/skscla001/speech/data/swagen/audio/common_voice_sw_30385728.wav	mkwavinyika munyigumba alikuwa chifu na kiongozi mkuu wa wahehe 
/scratch/skscla001/speech/data/swagen/audio/common_voice_sw_29936833.wav	matawi maarufu wakati huo kama nyota ya asubuhi 
/scratch/skscla001/speech/data/swagen/audio/common_voice_sw_31321674.wav	washambaa wanaishi kwenye milima ya usambara na lugha yao kubwa ni kisambaa 
/scratch/skscla001/speech/data/swagen/audio/common_voice_sw_31308571.wav	kwani ilikuwa haijaungana na visiwa vya zanzibari 
/scratch/skscla001/speech/data/swagen/audio/common_voice_sw_30364123.wav	ndani ya kipindi cha miaka sita aliyoichezea newells aliifungia magoli takribani mia tano 
/scratch/skscla001/speech/data/swagen/audio/common_voice_sw_31858688.wav	yaani ni kitu ambacho hakikua vile kilvyokua 
/scratch/skscla001/speech/data/swagen/audio/common_voice_sw_34763927.wav	sawa karibu sanaaliongea maneno hayo huku akipiga muhuri pasi ya jacob 
/scratch/skscla001/speech/data/swagen/audio/common_voice_sw_30634778.wav	messi amejiunga na matajiri wa ufaransa 
/scratch/skscla001/speech/data/swagen/audio/common_voice_sw_30320144.wav	fukwe za wazi ambazo watu hupenda kupunga upepo na kufurahia vyakula 
/scratch/skscla001/speech/data/swagen/audio/common_voice_sw_29810958.wav	zimedharauliwa na kutukuza kanuni za kibinadamu 
/scratch/skscla001/speech/data/swagen/audio/common_voice_sw_29795994.wav	ni shule ya mafunzo ya vijana wa kike huku yote yakiwa na lengo 
/scratch/skscla001/speech/data/swagen/audio/common_voice_sw_28582834.wav	papa gregori i aliandika juu yake sura moja ya kitabu cha majadiliano 
/scratch/skscla001/speech/data/swagen/audio/common_voice_sw_30132901.wav	kifua kikuu kikiambukiza kinaathiri mapafu kwa asilimia tisini ya wagonjwa sita 
/scratch/skscla001/speech/data/swagen/audio/common_voice_sw_30041757.wav	waliyachukua na kuyapeleka ulaya kwa ajili ya kutengeneza bidhaa 
/scratch/skscla001/speech/data/swagen/audio/common_voice_sw_28691022.wav	huu ni miongoni mwa miji ya zamani sana nchini uswidi 
/scratch/skscla001/speech/data/swagen/audio/common_voice_sw_30327334.wav	kukuza uchumi ikaanza kutengeneza meli za kuabiria kusini hadi miji mingine 
/scratch/skscla001/speech/data/swagen/audio/common_voice_sw_36067295.wav	alipenda viumbe wengine wa porini 
/scratch/skscla001/speech/data/swagen/audio/common_voice_sw_36945733.wav	kumaliza tofauti zao kufuatia mzozo uliotishia kusambaratisha serikali 
/scratch/skscla001/speech/data/swagen/audio/common_voice_sw_30201827.wav	kila ukoo ulikuwa na kitu walichokatazwa kula omuziro 
/scratch/skscla001/speech/data/swagen/audio/common_voice_sw_29915568.wav	papa yohane paulo huazimisha sikukuu yake kila mwaka tarehe 
/scratch/skscla001/speech/data/swagen/audio/common_voice_sw_30201574.wav	wachezaji wengi wakubwa nchini ujerumani wanacheza bayern munich 
/scratch/skscla001/speech/data/swagen/audio/common_voice_sw_28582893.wav	milo iliyotengenezwa nje ya australia hutengenezwa tofauti ili kutumika kwa urahisi 
/scratch/skscla001/speech/data/swagen/audio/common_voice_sw_29788774.wav	kihistori brazil iliwahi kutawaliwa na wareno 
/scratch/skscla001/speech/data/swagen/audio/common_voice_sw_36387865.wav	anatambuliwa kwa jina la al myidhan 
/scratch/skscla001/speech/data/swagen/audio/common_voice_sw_29787613.wav	forlan aliweka rekodi ya kufunga mabao matatu nje ya boksi 
/scratch/skscla001/speech/data/swagen/audio/common_voice_sw_30180831.wav	pesa inayopatikana inasaidia miradi mbalimbali 
/scratch/skscla001/speech/data/swagen/audio/common_voice_sw_30201229.wav	mataifa makubwa ya ulaya yalikuwa ni uingereza na ufaransa 
/scratch/skscla001/speech/data/swagen/audio/common_voice_sw_30079880.wav	akabadilisha upepo uliodumu kwa miaka kumi na nne 
/scratch/skscla001/speech/data/swagen/audio/common_voice_sw_36375012.wav	katibu mkuu wa nato andes forgrasmel 
/scratch/skscla001/speech/data/swagen/audio/common_voice_sw_29997508.wav	yani mwalimu julius kambarage nyerere kwa upande wa tanganyika 
/scratch/skscla001/speech/data/swagen/audio/common_voice_sw_30634640.wav	wanafunzi watamkumbuka mkapa kwa kuwaletea mikopo 
/scratch/skscla001/speech/data/swagen/audio/common_voice_sw_29982110.wav	hii ni pale ambapo binadamu awae yote anahakikisha kuwa anajijali 
/scratch/skscla001/speech/data/swagen/audio/common_voice_sw_30149279.wav	amin alianza kudai kwamba eneo la kagera sehemu kubwa ya ardhi ya tanzania 
/scratch/skscla001/speech/data/swagen/audio/common_voice_sw_29941748.wav	raisi john magufuli aliingia madarakani rasmi 
/scratch/skscla001/speech/data/swagen/audio/common_voice_sw_30579080.wav	matunda mengi tuliyachuma katika msitu na vichaka maeneo ya nyika juu ya miiba 
/scratch/skscla001/speech/data/swagen/audio/common_voice_sw_30025865.wav	baadae alipata fursa ya kuwa kaimu katibu wa uhamasishaji wa umoja wa vijana 
/scratch/skscla001/speech/data/swagen/audio/common_voice_sw_36390747.wav	ti huo ambo nchi hiyo iko katika mchakato wa kura ya maoni 
/scratch/skscla001/speech/data/swagen/audio/common_voice_sw_29975068.wav	uhifadhi wa wanyamapori ni muhimu sana kwa taifa 
/scratch/skscla001/speech/data/swagen/audio/common_voice_sw_30257386.wav	afrika kusini walijivunia kweli walichoamini na kukitekeleza 
/scratch/skscla001/speech/data/swagen/audio/common_voice_sw_29994962.wav	halmashauri ya bagamoyo inaundwa na tarafa mbili 
/scratch/skscla001/speech/data/swagen/audio/common_voice_sw_30149412.wav	ubovu wa barabara wilayani humo umepandisha bei ya bidhaa za madukani 
/scratch/skscla001/speech/data/swagen/audio/common_voice_sw_30257509.wav	majengo ya zamani na magofu bado ni alama ya mji wa bagamoyo 
/scratch/skscla001/speech/data/swagen/audio/common_voice_sw_36387520.wav	wewe utaanguka 
/scratch/skscla001/speech/data/swagen/audio/common_voice_sw_32323935.wav	imamu kanaigauza nyumba kuwa nsikiti 
/scratch/skscla001/speech/data/swagen/audio/common_voice_sw_29996312.wav	tuhangaikie malazi mavazi na chakula 
/scratch/skscla001/speech/data/swagen/audio/common_voice_sw_36382203.wav	chakula cha baba ni kizuri sana 
/scratch/skscla001/speech/data/swagen/audio/common_voice_sw_29789359.wav	kupata mbinu za kilimo na ufugaji wa kisasa katika mazingira ya jiji 
/scratch/skscla001/speech/data/swagen/audio/common_voice_sw_30321798.wav	matibabu hupunguza vifo kwa asilimia nane hadi asilimia kumi 
/scratch/skscla001/speech/data/swagen/audio/common_voice_sw_36390438.wav	anasema aliingia kwenye siasa kuitikia mwito wa mungu wake chakwera mwenye umri wa miaka 
/scratch/skscla001/speech/data/swagen/audio/common_voice_sw_29947062.wav	ni mataifa ya ghana na ethiopia ambayo hayakutawaliwa na wakoloni 
/scratch/skscla001/speech/data/swagen/audio/common_voice_sw_28669846.wav	kosa dogo katika kuandika linaweza kusababisha madhara makubwa 
/scratch/skscla001/speech/data/swagen/audio/common_voice_sw_29960192.wav	fikra zake za kisiasa alizipata nchini kenya 
/scratch/skscla001/speech/data/swagen/audio/common_voice_sw_29795509.wav	chuo kikuu cha daressalaam tanzania na chuo kikuucha salford uingereza 
/scratch/skscla001/speech/data/swagen/audio/common_voice_sw_28663196.wav	nchini kenya kiwango cha ukosefu wa ajira kimo juu sana 
/scratch/skscla001/speech/data/swagen/audio/common_voice_sw_30634784.wav	pombe za kienyeji kama ulanzi ili mtoto asisumbue 
/scratch/skscla001/speech/data/swagen/audio/common_voice_sw_29995901.wav	gadaffi alipigana kulinda maslahi ya libya 
/scratch/skscla001/speech/data/swagen/audio/common_voice_sw_30419879.wav	msamaha huo ulitolewa muda mfupi kabla ya nchi hiyo kupata uhuru 
/scratch/skscla001/speech/data/swagen/audio/common_voice_sw_28682398.wav	hii inatokea kila baada ya miaka kadhaa na kusababisha vifo 
/scratch/skscla001/speech/data/swagen/audio/common_voice_sw_30180300.wav	hutambulisha vivutio mbalimbali vilivyopo ndani ya nchi ya tanzania 
/scratch/skscla001/speech/data/swagen/audio/common_voice_sw_37224504.wav	amesema hapo kabla kulikuwa na taarifa za watu kufa 
/scratch/skscla001/speech/data/swagen/audio/common_voice_sw_36382631.wav	benki itawezesha mfumo thabiti wa kufanya malipo 
/scratch/skscla001/speech/data/swagen/audio/common_voice_sw_30201572.wav	mlima mzinga na mlima mzogoti unaongezeka pia mlima nankungulu 
/scratch/skscla001/speech/data/swagen/audio/common_voice_sw_36331336.wav	a hivi watu hivi wanaanza kupima kurudia kwao kwenye walitoka 
/scratch/skscla001/speech/data/swagen/audio/common_voice_sw_29993434.wav	mechi nyingi za michuano la kombe la dunia zilifanyika mjini azteca 
/scratch/skscla001/speech/data/swagen/audio/common_voice_sw_30025689.wav	kwa maana ya watu wanaotoka katika kijiji cha 
/scratch/skscla001/speech/data/swagen/audio/common_voice_sw_36381186.wav	ametuma salamu zake za rambirambi na kuahidi watakuwa tayari 
/scratch/skscla001/speech/data/swagen/audio/common_voice_sw_36383667.wav	katika ya jamii yote ya kimasai ndani kenya na tanzania 
/scratch/skscla001/speech/data/swagen/audio/common_voice_sw_36390650.wav	mungu huyu ni mwenye nguvu na anayeyajua mambo yote 
/scratch/skscla001/speech/data/swagen/audio/common_voice_sw_28691422.wav	iko ndani ya jiji la dar es salaam 
/scratch/skscla001/speech/data/swagen/audio/common_voice_sw_38098334.wav	ushirikiano udumishwe kati ya rwanda na uganda dhidi ya waasi 
/scratch/skscla001/speech/data/swagen/audio/common_voice_sw_29963209.wav	inapatikana mkoani morogoro na ilianzishwa mwaka wa elfu moja mia tisa sitini na nne 
/scratch/skscla001/speech/data/swagen/audio/common_voice_sw_30634763.wav	hivyo kuwa kivutio kikubwa kwa watalii wa ndani na nje ya nchi 
/scratch/skscla001/speech/data/swagen/audio/common_voice_sw_36381517.wav	afisa alimwokoa winnie na watoto wake 
/scratch/skscla001/speech/data/swagen/audio/common_voice_sw_32244815.wav	wagonjwa wameambiwa kuboresha afya zao 
/scratch/skscla001/speech/data/swagen/audio/common_voice_sw_29942173.wav	aliwaongoza watanzania katika serikali ya awamu ya tatu 
/scratch/skscla001/speech/data/swagen/audio/common_voice_sw_28691064.wav	dalili hasi ni pamoja na hisia bapa au hafifu 
/scratch/skscla001/speech/data/swagen/audio/common_voice_sw_36385183.wav	kesi nyingine za watu ishirini na tano zinaendelea 
/scratch/skscla001/speech/data/swagen/audio/common_voice_sw_32243783.wav	pokea zawadi kutoka kwa baba 
/scratch/skscla001/speech/data/swagen/audio/common_voice_sw_30181436.wav	chenga za lionel mesi ziliwatengua nyonga mabeki 
/scratch/skscla001/speech/data/swagen/audio/common_voice_sw_30628166.wav	wakataka waongozaji wa watalii waongezewe elimu 
/scratch/skscla001/speech/data/swagen/audio/common_voice_sw_30025797.wav	misimu mitatu ya mafanikio ilifuatia 
/scratch/skscla001/speech/data/swagen/audio/common_voice_sw_30354920.wav	pia wilaya za igunga na sikonge bila kusahau tabora na urambo 
/scratch/skscla001/speech/data/swagen/audio/common_voice_sw_29974204.wav	maporomoko ya maji milima na mabonde vianpatikana ndani ya kitulo 
/scratch/skscla001/speech/data/swagen/audio/common_voice_sw_30342458.wav	imetazamiwa ya kwamba barafuto kwenye mitelemko ilirudi nyuma 
/scratch/skscla001/speech/data/swagen/audio/common_voice_sw_30634562.wav	lakini pia wageni wengi walihamia huku na kuanzisha makazi ya kudumu 
/scratch/skscla001/speech/data/swagen/audio/common_voice_sw_28583813.wav	miungu wa juu ni watatu walio safi 
/scratch/skscla001/speech/data/swagen/audio/common_voice_sw_36318757.wav	anahakikisha mafanikio katika vita au mvua za kutosha 
/scratch/skscla001/speech/data/swagen/audio/common_voice_sw_29943174.wav	tanzania tunayo maeneo muhimu kwa utalii kama hifadhi za taifa 
/scratch/skscla001/speech/data/swagen/audio/common_voice_sw_30674910.wav	alipata shahada ya sayansi ya siasa na falsafa 
/scratch/skscla001/speech/data/swagen/audio/common_voice_sw_30320107.wav	hifadhi ya asili ya amani ina ufugaji wa vipepeo 
/scratch/skscla001/speech/data/swagen/audio/common_voice_sw_36387243.wav	alisimama na kuwaahidi wamatumbi kuingia katika vita aliyoiita vita ya ushindi 
/scratch/skscla001/speech/data/swagen/audio/common_voice_sw_30002214.wav	timu nyingi zilikuja afrika kwenye kombe la dunia 
